id,url,area,beds,baths,image,price,county,status,currency,homeType,latitude,agentName,longitude,yearBuilt,addressRaw,agentEmail,brokerName,description,daysOnZillow,agentPhoneNumber,brokerPhoneNumber,highSchoolDisctrict,elementarySchoolDistrict,middleOrJuniorSchoolDistrict,elementarySchool,middleOrJuniorSchool,photos.0,photos.1,photos.2,photos.3,photos.4,photos.5,photos.6,photos.7,photos.8,photos.9,photos.10,photos.11,photos.12,photos.13,photos.14,photos.15,photos.16,photos.17,photos.18,photos.19,photos.20,photos.21,photos.22,photos.23,photos.24,photos.25,photos.26,photos.27,photos.28,photos.29,photos.30,photos.31,photos.32,photos.33,photos.34,photos.35,photos.36,photos.37,photos.38,photos.39,photos.40,photos.41,photos.42,photos.43,photos.44,photos.45,photos.46,photos.47,photos.48,photos.49,photos.50,photos.51,photos.52,photos.53,photos.54,photos.55,address.city,address.state,address.street,address.zipcode,photos.56,photos.57,photos.58,photos.59,photos.60,photos.61,photos.62,photos.63,photos.64,photos.65,photos.66,photos.67,photos.68,photos.69,photos.70,photos.71,photos.72,photos.73,photos.74,photos.75,photos.76,photos.77,photos.78,photos.79,photos.80,photos.81,photos.82,photos.83,photos.84,photos.85,photos.86,photos.87
122063974,https://www.zillow.com/homedetails/121-Otter-Cove-Ter-San-Francisco-CA-94134/122063974_zpid/,1878,4,3,https://photos.zillowstatic.com/fp/9d50f68140fdc49410a88da82fa6cc4b-cc_ft_1536.jpg,1020000,San Francisco County,RECENTLY_SOLD,USD,TOWNHOUSE,37.712578,Linda Lam,-122.39442,2013,121 Otter Cove Ter,linda.lam@compass.com,Compass,"This 3-level townhome charmer tucked in Candlestick Cove boasts 1,878-SF interior lined in hardwoods and appointed w/ ample windows. Guests are met w/ an open concept that seamlessly merges living/dining/kitchen in one bright, airy expanse. Decked in granite, an eat-in kitchen is poised for dinner parties, with S/S appliances and peninsula island with bar seating. Perfect for a growing family, 2 bedrooms, a full bath, and laundry lie on the main floor. The 3rd floor is a sumptuous retreat, equipped w/ a sprawling primary suite w/ his/hers walk-in closets, luxe ensuite bath and cozy den. The ground floor includes a guest suite, full bath, and 2-car garage w/ side-by-side parking. Located near Highway 280/101 and Cal Train, 121 Otter Cove offers free shuttle service to Glen Park BART. A pet-friendly community w/ shared gardens and play areas, the association fee includes common area maintenance, exterior maintenance, professional mgmt, water. The property is virtually staged.",272,415-738-7042,415-738-7000,,,,,,https://photos.zillowstatic.com/fp/9d50f68140fdc49410a88da82fa6cc4b-cc_ft_1536.jpg,https://photos.zillowstatic.com/fp/7678766503433e9a3df469ce145631b4-cc_ft_1536.jpg,https://photos.zillowstatic.com/fp/ffb8184688a4b6f6c24e68b66d736974-cc_ft_1536.jpg,https://photos.zillowstatic.com/fp/018deaadc78ee7468dd4944236797554-cc_ft_1536.jpg,https://photos.zillowstatic.com/fp/e3a8fd3b223feb9849c20c895340b280-cc_ft_1536.jpg,https://photos.zillowstatic.com/fp/49c3d9430d95da7f50a6566fcac066d0-cc_ft_1536.jpg,https://photos.zillowstatic.com/fp/079c7a8b1d93ec449111d10645501790-cc_ft_1536.jpg,https://photos.zillowstatic.com/fp/42c9cdd115d7fcc1dbf1d4f038187b51-cc_ft_1536.jpg,https://photos.zillowstatic.com/fp/2e709ecd7527ef66dd57d42d2d246bf1-cc_ft_1536.jpg,https://photos.zillowstatic.com/fp/098f5093ac63359728844cf0fa247918-cc_ft_1536.jpg,https://photos.zillowstatic.com/fp/79afbc2f9f49d3c9d7caecb7b4af80f7-cc_ft_1536.jpg,https://photos.zillowstatic.com/fp/909f6dbc09cdf19d402f7755058a46e0-cc_ft_1536.jpg,https://photos.zillowstatic.com/fp/2b2a11e9d12976e5e0239f56b16491fb-cc_ft_1536.jpg,https://photos.zillowstatic.com/fp/dbc5874179f9e94f1d0fc4c868ffcbab-cc_ft_1536.jpg,https://photos.zillowstatic.com/fp/1f583906749ebfaea50066882079a76c-cc_ft_1536.jpg,https://photos.zillowstatic.com/fp/67544c3efe7443f7e429deae51b0996d-cc_ft_1536.jpg,https://photos.zillowstatic.com/fp/672bb28f47a117f7177dfc10a47313ea-cc_ft_1536.jpg,https://photos.zillowstatic.com/fp/e2411d21a6b1215490debe53343784f3-cc_ft_1536.jpg,https://photos.zillowstatic.com/fp/f2a422badb75d2eadc49708f7faedc9b-cc_ft_1536.jpg,https://photos.zillowstatic.com/fp/efc202f86a97ae00b8aa5471697a5be5-cc_ft_1536.jpg,https://photos.zillowstatic.com/fp/0535e4860a9facee21a29e68fc3610de-cc_ft_1536.jpg,https://photos.zillowstatic.com/fp/46683e3947b5f8cd12fc197565a0df8d-cc_ft_1536.jpg,https://photos.zillowstatic.com/fp/5d62ae8cb0ab3559e7ecc0738d913e85-cc_ft_1536.jpg,https://photos.zillowstatic.com/fp/0dcaaa3ab9707873d29173bd44a9280d-cc_ft_1536.jpg,https://photos.zillowstatic.com/fp/6a95fdf097cb9431cff08ecae6523e39-cc_ft_1536.jpg,https://photos.zillowstatic.com/fp/0f0fb28af16bfdbf17f7b8b2fc3e2457-cc_ft_1536.jpg,https://photos.zillowstatic.com/fp/c85a5ed6732d338f9b811d0a574a0412-cc_ft_1536.jpg,https://photos.zillowstatic.com/fp/9537c543f47336735f05b1e22b78a6a5-cc_ft_1536.jpg,https://photos.zillowstatic.com/fp/2720674986a8972f471713508b45a963-cc_ft_1536.jpg,https://photos.zillowstatic.com/fp/df923473575e40987e2bd251b5d0b251-cc_ft_1536.jpg,https://photos.zillowstatic.com/fp/e42da5828843fa2b9a81b27a7dfb219c-cc_ft_1536.jpg,https://photos.zillowstatic.com/fp/6e2f776e3588ac1c8f53e5baa54c2e45-cc_ft_1536.jpg,https://photos.zillowstatic.com/fp/3794ba8713eae3c28af9f73703ff58db-cc_ft_1536.jpg,https://photos.zillowstatic.com/fp/85350e3b30553c555ac54a2dd5d38611-cc_ft_1536.jpg,https://photos.zillowstatic.com/fp/f302f056edc26a4cb396308ac8c91035-cc_ft_1536.jpg,https://photos.zillowstatic.com/fp/f8324d6dda6ce018e56f33cef697ee4d-cc_ft_1536.jpg,https://photos.zillowstatic.com/fp/3d888f6aa08034fdabb39e3494c904fd-cc_ft_1536.jpg,https://photos.zillowstatic.com/fp/5ccbb071c81cd57589da600d88a46f7c-cc_ft_1536.jpg,https://photos.zillowstatic.com/fp/e1f55ff61df34d599c49ec44ecd64364-cc_ft_1536.jpg,https://photos.zillowstatic.com/fp/4cb91258c9e9f3d4f84763a329d1f6ca-cc_ft_1536.jpg,https://photos.zillowstatic.com/fp/07a393049b8a63321773154414d88045-cc_ft_1536.jpg,https://photos.zillowstatic.com/fp/16986323e4b94e65dad8368f0d32e6e8-cc_ft_1536.jpg,https://photos.zillowstatic.com/fp/c2d51d5285a42e5a5ef89c8642c2005b-cc_ft_1536.jpg,https://photos.zillowstatic.com/fp/bce6be5133b9ad346da39f58882863a9-cc_ft_1536.jpg,https://photos.zillowstatic.com/fp/8e794e3258dcc92b1399bde766f960a9-cc_ft_1536.jpg,https://photos.zillowstatic.com/fp/473b88414c5eaaaf200e2576544577c3-cc_ft_1536.jpg,https://photos.zillowstatic.com/fp/ede1d11f3fc5545b378552179514e623-cc_ft_1536.jpg,https://photos.zillowstatic.com/fp/d901cd11eea09eedcb995f9fd27b6948-cc_ft_1536.jpg,https://photos.zillowstatic.com/fp/d786dc1fe5e50fd5c61d6b78a2ea5aad-cc_ft_1536.jpg,https://photos.zillowstatic.com/fp/2c4392857f74f773ea19623afc571c84-cc_ft_1536.jpg,https://photos.zillowstatic.com/fp/873c7ce7b11f95d4fdff0c2b8c053fa4-cc_ft_1536.jpg,https://photos.zillowstatic.com/fp/9e6df3afd0ee32173616a3c2719a98b4-cc_ft_1536.jpg,https://photos.zillowstatic.com/fp/b618cf4338df94fd90ebbaf2a5764992-cc_ft_1536.jpg,https://photos.zillowstatic.com/fp/a3e7abb7a57610004151778b2de8355c-cc_ft_1536.jpg,https://photos.zillowstatic.com/fp/d3a8a5de460a01b81fa88b9b405a4167-cc_ft_1536.jpg,https://photos.zillowstatic.com/fp/fe994fa5bd864b1aa3fe08b658f4d5b4-cc_ft_1536.jpg,San Francisco,CA,121 Otter Cove Ter,94134,,,,,,,,,,,,,,,,,,,,,,,,,,,,,,,,
15200288,https://www.zillow.com/homedetails/154-Everson-St-San-Francisco-CA-94131/15200288_zpid/,1605,3,2,https://photos.zillowstatic.com/fp/69fa567fc464cc6b88bdb4d87e3eccc8-cc_ft_1536.jpg,1500000,San Francisco County,RECENTLY_SOLD,USD,TOWNHOUSE,37.739082,Ric A. Rocchiccioli,-122.432625,1973,154 Everson St,ric.rocchiccioli@compass.com,Compass,"Tranquility and stunning Western & Eastern-facing Ocean and Bay Views are showcased in this modern 3 bedroom, 1.5 bath townhome atop Everson ridge between Glen Park and Noe Valley. The light-filled main level boasts views of Downtown, Mt. Diablo, the Bay and beyond from the living room and private balcony, and of the Southern Hills from the dining room. The open kitchen features maple cabinets, stainless steel appliances, honed black granite counters with custom tile accents, and an eating bar. Enjoy unique architectural details, a fireplace, Brazilian hardwood floors and recessed lighting throughout the level, along with a large half bath. On the top level, the rear bedroom has a walk-in closet and city views. The spacious and sunny primary bedroom has views of the Southern Hills and Pacific, plus ample custom closet space. A full bath sits between. The third bedroom or home office is on the entry level with direct access to a private and peaceful patio/garden.",279,415-265-1164,415-738-7000,,,,,,https://photos.zillowstatic.com/fp/69fa567fc464cc6b88bdb4d87e3eccc8-cc_ft_1536.jpg,,,,,,,,,,,,,,,,,,,,,,,,,,,,,,,,,,,,,,,,,,,,,,,,,,,,,,,,San Francisco,CA,154 Everson St,94131,,,,,,,,,,,,,,,,,,,,,,,,,,,,,,,,
2064109303,https://www.zillow.com/homedetails/143-Habitat-Ter-San-Francisco-CA-94112/2064109303_zpid/,1589,3,2,https://photos.zillowstatic.com/fp/05bb150e57152c97f573637ecafdd1ff-cc_ft_1536.jpg,531775,San Francisco County,RECENTLY_SOLD,USD,TOWNHOUSE,37.71091,Derrick Mar,-122.46086,2016,143 Habitat Ter,derrick@derrickmar.com,Compass,"3 bedroom Below Market Rate (BMR) housing opportunity available at 100% Area Median Income (AMI). Maximum income for 3 person = $119,900; 4 = $133,200; 5 = $143,850; 6 = $154,500: 7 = $165,150, etc. Must be 1st-time homebuyer & income eligible. Unit available thru the Mayor's Office of Housing and Community Development (MOHCD) & subject to resale controls, monitoring & other restrictions. Unit will be listed on DAHLIA, the SF Housing Portal (https://housing.sfgov.org) starting on the application date, April 21, 2022. Visit https://housing.sfgov.org for application & program info. Application, loan pre-approval, and homebuyer education verification due Friday May 13, 2022 by 5pm. FAIR HOUSING OPPORTUNITY",282,415-806-6188,415-660-9955,,,,,,https://photos.zillowstatic.com/fp/05bb150e57152c97f573637ecafdd1ff-cc_ft_1536.jpg,https://photos.zillowstatic.com/fp/840689893251fbebf9c961b5952da5c4-cc_ft_1536.jpg,https://photos.zillowstatic.com/fp/a07e1045110f445133b24a54b9735641-cc_ft_1536.jpg,https://photos.zillowstatic.com/fp/e46054a513107c7f4b65210eff85328f-cc_ft_1536.jpg,https://photos.zillowstatic.com/fp/a447dd534ee5ed430066f69919612cd0-cc_ft_1536.jpg,https://photos.zillowstatic.com/fp/4713f8c51a6f2f2d1d567bfce04a4ef6-cc_ft_1536.jpg,https://photos.zillowstatic.com/fp/7518ec9331e9e761fda645ca02885778-cc_ft_1536.jpg,https://photos.zillowstatic.com/fp/6a1149fb0e8f621211c3cb1ecbb061b6-cc_ft_1536.jpg,https://photos.zillowstatic.com/fp/2dadcbbda414bd153fe886ddf5e6548d-cc_ft_1536.jpg,https://photos.zillowstatic.com/fp/d70664d4916ced2e28a66da70b0b11e7-cc_ft_1536.jpg,https://photos.zillowstatic.com/fp/656196c7ef906675c98efa1bc9fdfaed-cc_ft_1536.jpg,https://photos.zillowstatic.com/fp/a27615fcdb145d51ed4dd60a00d9878d-cc_ft_1536.jpg,https://photos.zillowstatic.com/fp/532b95531f4643015c2b2266e4233839-cc_ft_1536.jpg,https://photos.zillowstatic.com/fp/d314d88a1c2b5904cd8cb0812eaed427-cc_ft_1536.jpg,https://photos.zillowstatic.com/fp/adcb2ff5948cdc237e219471670884b5-cc_ft_1536.jpg,https://photos.zillowstatic.com/fp/c53cf5faa03215653c6d67c9d1b3854b-cc_ft_1536.jpg,https://photos.zillowstatic.com/fp/7334fb5af74aa765ae4ab52620adb001-cc_ft_1536.jpg,https://photos.zillowstatic.com/fp/486107018f16a25f2f71a5084ea05e00-cc_ft_1536.jpg,https://photos.zillowstatic.com/fp/1f671661bbcaa96a9170d37fdb5cb600-cc_ft_1536.jpg,https://photos.zillowstatic.com/fp/3112a1f72b93fe13b2cefb4d27501829-cc_ft_1536.jpg,https://photos.zillowstatic.com/fp/af4cfd55422cb09a2d760bca508f10dc-cc_ft_1536.jpg,,,,,,,,,,,,,,,,,,,,,,,,,,,,,,,,,,,,San Francisco,CA,143 Habitat Ter,94112,,,,,,,,,,,,,,,,,,,,,,,,,,,,,,,,
15132791,https://www.zillow.com/homedetails/145-Gardenside-Dr-APT-10-San-Francisco-CA-94131/15132791_zpid/,1180,2,1,https://photos.zillowstatic.com/fp/826175a5ad7a37325e4b744184eff150-cc_ft_1536.jpg,30000,San Francisco County,RECENTLY_SOLD,USD,TOWNHOUSE,37.754333,John L. LePage,-122.444984,1981,145 Gardenside Dr APT 10,johnlepagere@gmail.com,Corcoran Global Living,2BR/1.5BA top floor 2-level townhome style condo in a well run & professionally managed HOA * Rarely available light filled corner unit with windows on 3 sides * Panoramic city and bay views * Updated eat-in kitchen * Open dining room and living room with wood burning fireplace * Private deck to get outside and enjoy your fantastic view * A half BA completes the main level * 2 excellent sized bedrooms up with great closet space * Full BA on the the upper level  * Brand new carpet throughout * Shared laundry (many owners have installed in-unit laundry) * 1 car garage parking & additional deeded storage * Central Twin Peaks location - close to public transportation and easy access to the Castro and Noe Valley,287,415-846-4074,,San Francisco,San Francisco,San Francisco,,,https://photos.zillowstatic.com/fp/826175a5ad7a37325e4b744184eff150-cc_ft_1536.jpg,https://photos.zillowstatic.com/fp/73feae87bacb555c1eae144d0bdcc67c-cc_ft_1536.jpg,https://photos.zillowstatic.com/fp/d439405aee6db1e2dd9d06b710d7646d-cc_ft_1536.jpg,https://photos.zillowstatic.com/fp/4d88990260494d1612d716c3e4d80803-cc_ft_1536.jpg,https://photos.zillowstatic.com/fp/f2dc45a33d8a3dbd802965c0a535ddf4-cc_ft_1536.jpg,https://photos.zillowstatic.com/fp/c67f603f046d0e79212be56618ba0fbf-cc_ft_1536.jpg,https://photos.zillowstatic.com/fp/b517ad2471ef37b61dc6149fe4e868f3-cc_ft_1536.jpg,https://photos.zillowstatic.com/fp/0263c5f6de3a210fe01dcef426971331-cc_ft_1536.jpg,https://photos.zillowstatic.com/fp/6fa4abd72e02be3d444d8bb1cf77f0eb-cc_ft_1536.jpg,https://photos.zillowstatic.com/fp/ff7cfeb808112b7741bb0bc377d849d8-cc_ft_1536.jpg,https://photos.zillowstatic.com/fp/75c39b823d838b7a941b26d564b85f05-cc_ft_1536.jpg,https://photos.zillowstatic.com/fp/25d655aadbd1fc0766a7e98bda4ab7ab-cc_ft_1536.jpg,https://photos.zillowstatic.com/fp/acb5c0829261a84f9a834ecf04e4a247-cc_ft_1536.jpg,https://photos.zillowstatic.com/fp/b14e62442b5e2bce8c5c392fc88e7409-cc_ft_1536.jpg,https://photos.zillowstatic.com/fp/6bc9830782ac8b95d4725a52c795ac99-cc_ft_1536.jpg,https://photos.zillowstatic.com/fp/447bbee04ee64c7c7b55d5e60d3c0b8a-cc_ft_1536.jpg,https://photos.zillowstatic.com/fp/bd54a6936a4378229815b8ccfbde8c4e-cc_ft_1536.jpg,https://photos.zillowstatic.com/fp/0ec448e193c23c088707b9cea9701e34-cc_ft_1536.jpg,https://photos.zillowstatic.com/fp/cd6b54ab83074c22158529d19cfeada3-cc_ft_1536.jpg,,,,,,,,,,,,,,,,,,,,,,,,,,,,,,,,,,,,,,San Francisco,CA,145 Gardenside Dr APT 10,94131,,,,,,,,,,,,,,,,,,,,,,,,,,,,,,,,
89239135,https://www.zillow.com/homedetails/2405-Folsom-St-APT-5-San-Francisco-CA-94110/89239135_zpid/,1950,3,4,https://photos.zillowstatic.com/fp/c538dfe6417428a4caf94d6678ba8e73-cc_ft_1536.jpg,1600000,San Francisco County,RECENTLY_SOLD,USD,TOWNHOUSE,37.758743,Frank A. Nolan,-122.41437,2008,2405 Folsom St APT 5,frank@vanguardsf.com,Vanguard Properties,"The residence at 2405 Folsom St No. 5 is a spacious and modern home in a vibrant neighborhood. The three-level home was built in 2008 and has been nicely updated since then. The floor plan is generous and includes two terraces that provide plenty of natural light and space, making it feel like a single-family home. On the first floor, there is a living, dining area and kitchen that runs from the front to the back of the residence. This area also includes an attached terrace. The second level is just as bright and spacious and features two ensuite bedrooms and a laundry room. Finally, the third level is dedicated entirely to the primary suite, which includes a large spa-like bathroom, walk-in closet, wet bar, and a large outdoor terrace. In addition to the ample living space, the residence also comes with two car parking. Overall, this is a comfortable and convenient living space in one of the best locations in the city.",2,,415-321-7000,San Francisco,San Francisco,San Francisco,,,https://photos.zillowstatic.com/fp/c538dfe6417428a4caf94d6678ba8e73-cc_ft_1536.jpg,https://photos.zillowstatic.com/fp/c962bec84b2745fde270506ebabaa464-cc_ft_1536.jpg,https://photos.zillowstatic.com/fp/030d00b453955475a001a0e496d56780-cc_ft_1536.jpg,https://photos.zillowstatic.com/fp/043e37c6f5d3dfb5c94f005fd47f6938-cc_ft_1536.jpg,https://photos.zillowstatic.com/fp/80b818395becc8292f2db21ccf94a837-cc_ft_1536.jpg,https://photos.zillowstatic.com/fp/2fc82708fd46473f842e6efce08b0ec8-cc_ft_1536.jpg,https://photos.zillowstatic.com/fp/2ded95739189527b2036ad39bd1245c7-cc_ft_1536.jpg,https://photos.zillowstatic.com/fp/1c2889ec8b1fda215490c916c707fdf6-cc_ft_1536.jpg,https://photos.zillowstatic.com/fp/a81f49de898a81fd016267e696be6127-cc_ft_1536.jpg,https://photos.zillowstatic.com/fp/731f55068f726ea86778ce477d9576a1-cc_ft_1536.jpg,https://photos.zillowstatic.com/fp/0e7c4f58e67f8678c473d524104b99f8-cc_ft_1536.jpg,https://photos.zillowstatic.com/fp/ab43f7a6bd50712f7c060515a01cd0db-cc_ft_1536.jpg,https://photos.zillowstatic.com/fp/bfaef110ca114194b5eb32b70ecc2035-cc_ft_1536.jpg,https://photos.zillowstatic.com/fp/01396e8039c6edd72f554a7bf2143c0a-cc_ft_1536.jpg,https://photos.zillowstatic.com/fp/5862cdf60c8288ba7fd75af835152203-cc_ft_1536.jpg,https://photos.zillowstatic.com/fp/121e9af50a5da618c11aef0a3850b07d-cc_ft_1536.jpg,https://photos.zillowstatic.com/fp/028ee6665cf2632419478c22cce6e1a5-cc_ft_1536.jpg,https://photos.zillowstatic.com/fp/f6f6916228571aa84ae5fc3fc34f6864-cc_ft_1536.jpg,https://photos.zillowstatic.com/fp/51271bca533bc093aa05a0443b9def23-cc_ft_1536.jpg,https://photos.zillowstatic.com/fp/91e86e3596778ce92b0d3eb24338db98-cc_ft_1536.jpg,https://photos.zillowstatic.com/fp/afbec8d9dece857fbf91d2f75bd0904e-cc_ft_1536.jpg,https://photos.zillowstatic.com/fp/b4152f2dda3b694baa69d02431f502bc-cc_ft_1536.jpg,https://photos.zillowstatic.com/fp/e91b9b3903a93f7b174d4eb2e46f81f5-cc_ft_1536.jpg,https://photos.zillowstatic.com/fp/99e50a604621c7b775065beea32c6b13-cc_ft_1536.jpg,https://photos.zillowstatic.com/fp/da8faabe4dad50fa3a10a02d867c6efd-cc_ft_1536.jpg,https://photos.zillowstatic.com/fp/227fe41acd91dc2112111cc63ecb08be-cc_ft_1536.jpg,https://photos.zillowstatic.com/fp/57944265573fa80c6ddf153163aa9c1e-cc_ft_1536.jpg,https://photos.zillowstatic.com/fp/4b1105a2793e94c97deb94779906afff-cc_ft_1536.jpg,,,,,,,,,,,,,,,,,,,,,,,,,,,,,San Francisco,CA,2405 Folsom St APT 5,94110,,,,,,,,,,,,,,,,,,,,,,,,,,,,,,,,
15147930,https://www.zillow.com/homedetails/20-Scott-Aly-San-Francisco-CA-94107/15147930_zpid/,1092,0,1,https://photos.zillowstatic.com/fp/cb453af8efa4513aa7fd87dfae29a6ee-cc_ft_1536.jpg,699800,San Francisco County,RECENTLY_SOLD,USD,TOWNHOUSE,37.779755,Gina R. Gianopoulos,-122.40218,1997,20 Scott Aly,gina@foundersrealty.com,Founders Real Estate Svcs.,"1997 townhouse on a gated private street, Low HOA dues, main floor one bedroom, full bath, vaulted ceilings, updated kitchen, marble gas fireplace, 4th floor features family room or office with skylights. First floor garage and laundry area",13,415-418-9086,415-682-2660,,,,,,https://photos.zillowstatic.com/fp/cb453af8efa4513aa7fd87dfae29a6ee-cc_ft_1536.jpg,https://photos.zillowstatic.com/fp/b5258d6e2361fcccba83f07a2b25ad49-cc_ft_1536.jpg,https://photos.zillowstatic.com/fp/1bf1cb16fcd491c7c4130addd1667e41-cc_ft_1536.jpg,https://photos.zillowstatic.com/fp/f40c99b747bfcfd6e9fecb8530367112-cc_ft_1536.jpg,https://photos.zillowstatic.com/fp/812a76e2407acebfa84346ecdca14e77-cc_ft_1536.jpg,https://photos.zillowstatic.com/fp/7437a5e338c99779ee3ca98e672f2289-cc_ft_1536.jpg,https://photos.zillowstatic.com/fp/d1205692bfaa751177d422b3075b2b7b-cc_ft_1536.jpg,https://photos.zillowstatic.com/fp/1408393f912ca8c22f3a62f377251b13-cc_ft_1536.jpg,https://photos.zillowstatic.com/fp/80e9ecd4f26b1692520456b2669b80de-cc_ft_1536.jpg,https://photos.zillowstatic.com/fp/e970cc2823ae5a4ee697c5bf048801e2-cc_ft_1536.jpg,https://photos.zillowstatic.com/fp/9d447d002dad7a920978eb0a2699c293-cc_ft_1536.jpg,https://photos.zillowstatic.com/fp/d20bf7d63af375388524f1b17829d7b0-cc_ft_1536.jpg,https://photos.zillowstatic.com/fp/a66684217657ffc560daefd6b13fffb7-cc_ft_1536.jpg,https://photos.zillowstatic.com/fp/34c1012e8975b9414e3cce6b3c5abb99-cc_ft_1536.jpg,https://photos.zillowstatic.com/fp/d74592d9ef06d83bb615fcdd79056325-cc_ft_1536.jpg,https://photos.zillowstatic.com/fp/7783b7a267e5b94fe14f6f6bb25c14c8-cc_ft_1536.jpg,https://photos.zillowstatic.com/fp/8ec96370dd49ec49ad8bfa577f98c39c-cc_ft_1536.jpg,https://photos.zillowstatic.com/fp/ec7cc2eaca979d74e34cb0d51b708424-cc_ft_1536.jpg,https://photos.zillowstatic.com/fp/4598ba4a8f0804df404e2fd71aeb6d97-cc_ft_1536.jpg,https://photos.zillowstatic.com/fp/e87e64cfe60eeff40c90c4c80f5b9d7d-cc_ft_1536.jpg,https://photos.zillowstatic.com/fp/aa2ad3633c00540b99872a5c87d74115-cc_ft_1536.jpg,,,,,,,,,,,,,,,,,,,,,,,,,,,,,,,,,,,,San Francisco,CA,20 Scott Aly,94107,,,,,,,,,,,,,,,,,,,,,,,,,,,,,,,,
2057771416,https://www.zillow.com/homedetails/306-Lily-St-APT-B-San-Francisco-CA-94102/2057771416_zpid/,800,2,1,https://photos.zillowstatic.com/fp/f9defb9b116af88f941957027e2a1cda-cc_ft_1536.jpg,920000,San Francisco County,RECENTLY_SOLD,USD,TOWNHOUSE,37.7743,Scott A. Rose,-122.42619,1985,306 Lily St APT B,scott.rose@corcoranicon.com,Corcoran Icon Properties,"The best parts of San Francisco are at your fingertips in this centrally located Hayes Valley Townhouse. This condo gem has the feeling of a single family home with no one above or below you. Enter the home through your private garden walkway which takes you away from the sounds of the street.  The lower level of this home consists of two quiet bedrooms as well as a full remodeled bathroom with new tile shower and quartz vanity. The highlight of this property is in the upstairs, sun-drenched great room. This room, with vaulted ceilings, is large enough for a spacious living room setup and a dining nook as well. With the attached kitchen, this layout is perfect for entertaining guest. The fully remodeled chef's kitchen boasts all new cabinets, all new hardware, new quartz countertops, new tile backsplash and all new stainless steel appliances. This upstairs room enjoys all day sun with massive south facing windows and multiple skylights. The home has also enjoyed all new interior paint, new engineered wood floors, new lighting throughout and updated electrical. Enjoy some green space in the Hayes Valley sun with shared yard in the back of the property. The world is at your fingertips with the best parts of San Francisco and Hayes Valley within walking distance of this home.",13,415-678-7883,415-695-7707,,,,,,https://photos.zillowstatic.com/fp/f9defb9b116af88f941957027e2a1cda-cc_ft_1536.jpg,https://photos.zillowstatic.com/fp/7d9c0510e0198194c497a6e4b63d2388-cc_ft_1536.jpg,https://photos.zillowstatic.com/fp/f19fdf89cae18c4078473f0be75eb900-cc_ft_1536.jpg,https://photos.zillowstatic.com/fp/ac5428d6707b09c0c9d3ef2dfa1651aa-cc_ft_1536.jpg,https://photos.zillowstatic.com/fp/bdd176dafe6ad42fd1427b9b97dc9877-cc_ft_1536.jpg,https://photos.zillowstatic.com/fp/2693a0f3b4666240585435eb0a099cc6-cc_ft_1536.jpg,https://photos.zillowstatic.com/fp/413855922b2f23f0ca8d6ab1a30285ee-cc_ft_1536.jpg,https://photos.zillowstatic.com/fp/a022a36a31b206dd635c0371be8a69a1-cc_ft_1536.jpg,https://photos.zillowstatic.com/fp/111dbeef0918062658b6bd24d7247dfe-cc_ft_1536.jpg,https://photos.zillowstatic.com/fp/2eea8c67078df2cad07534f84ad54a39-cc_ft_1536.jpg,https://photos.zillowstatic.com/fp/1cb09dd031b5db9c167ffc167c273fe5-cc_ft_1536.jpg,https://photos.zillowstatic.com/fp/47f4dee158aba49fddec2810d1289639-cc_ft_1536.jpg,https://photos.zillowstatic.com/fp/8a3d294be78919a84e5b70752843b727-cc_ft_1536.jpg,https://photos.zillowstatic.com/fp/8cff276b36b5e96b18b498df3899ee37-cc_ft_1536.jpg,https://photos.zillowstatic.com/fp/766d7480a2d47cfd55b2ec370a5b03cc-cc_ft_1536.jpg,https://photos.zillowstatic.com/fp/f8070ccb5afe6a9c6bbea40dd04abddf-cc_ft_1536.jpg,https://photos.zillowstatic.com/fp/be722bb37d70451cc90f5f584bc29fa0-cc_ft_1536.jpg,https://photos.zillowstatic.com/fp/7009b02ca3f4b18448c408b91cb46581-cc_ft_1536.jpg,https://photos.zillowstatic.com/fp/19c81fab7e4c3405b4cb4d0f1f3a1c1b-cc_ft_1536.jpg,https://photos.zillowstatic.com/fp/d107d35bb7522b7f4d82679e0b6a6015-cc_ft_1536.jpg,https://photos.zillowstatic.com/fp/b905e9fb626f9df19bcf8ecaa7bd91f3-cc_ft_1536.jpg,https://photos.zillowstatic.com/fp/47eb75c82260fa4dcb32e67d958122f2-cc_ft_1536.jpg,https://photos.zillowstatic.com/fp/6b6eff64aa85c95fd5971c9d72474893-cc_ft_1536.jpg,https://photos.zillowstatic.com/fp/ac62c575f7d5f56d0ebd2d1d5cea6e8a-cc_ft_1536.jpg,https://photos.zillowstatic.com/fp/284c44a1d080f02983b2636d4e24e981-cc_ft_1536.jpg,https://photos.zillowstatic.com/fp/e7df6af75f7871db7737f23dc6addeaf-cc_ft_1536.jpg,https://photos.zillowstatic.com/fp/00ed064ba363eb4ed499d107bc0d7930-cc_ft_1536.jpg,https://photos.zillowstatic.com/fp/a2e87a7a5a1ea2ffee78214bb471d31a-cc_ft_1536.jpg,https://photos.zillowstatic.com/fp/e6466355fe5a84561883dec443140f70-cc_ft_1536.jpg,https://photos.zillowstatic.com/fp/4b882ddfaccf03c747e71fd0e386af88-cc_ft_1536.jpg,https://photos.zillowstatic.com/fp/6f2ccc77641b2f1c71ee4ac6b25b3c74-cc_ft_1536.jpg,,,,,,,,,,,,,,,,,,,,,,,,,,San Francisco,CA,306 Lily St APT B,94102,,,,,,,,,,,,,,,,,,,,,,,,,,,,,,,,
