79844197,https://www.zillow.com/homedetails/881-Corbett-Ave-3-San-Francisco-CA-94131/79844197_zpid/,2633,3,3,https://photos.zillowstatic.com/fp/0d0cb7910810a8fb9f3dac620f84eaa1-cc_ft_1536.jpg,2050000,San Francisco County,SOLD,USD,TOWNHOUSE,37.752735,Justin Goldberg,-122.44353,1948,881 Corbett Ave #3,justin.goldberg@compass.com,Compass,"Space, openness, & views highlight this 3 bedroom + office, 3.5 bathroom home-like residence. This penthouse unit near the crest of Twin Peaks boasts coveted views of the Bay, skyline, East Bay hills, and Sutro Tower. An over-sized operable skylight and 3 sides of windows flood the upper level with natural light. Perfect for entertaining, this level includes a gourmet kitchen with adjacent patio for dining/ lounging, sizable dining room, & massive living room including a gas fireplace & balcony.  An office & half bathroom complete the floor & suit both hosting & personal needs. 3 spacious ensuite bedrooms make up the living quarters. The primary suite offers views overlooking the City & Bay, a gas fireplace, large adjacent balcony, & custom walk-in closet. The en-suite bathroom includes a standing shower, soaking tub, and dual vanities. Sizeable guest suites enjoy views of Twin Peaks & Sutro Tower. Laundry & additional storage finish the level. 1 deeded parking space is included.",948,415-533-9202,415-660-9955,San Francisco,San Francisco,San Francisco,,,https://photos.zillowstatic.com/fp/0d0cb7910810a8fb9f3dac620f84eaa1-cc_ft_1536.jpg,https://photos.zillowstatic.com/fp/f6252457a2f5870aff6f7a394a12cedd-cc_ft_1536.jpg,https://photos.zillowstatic.com/fp/bc6b2cc7b962b91bcdcb3c924278462c-cc_ft_1536.jpg,https://photos.zillowstatic.com/fp/9f470f16e11bfb1c6ca3ddcd915d70cb-cc_ft_1536.jpg,https://photos.zillowstatic.com/fp/4cc7b4f0a7d5dd86662b3f9e8a181be0-cc_ft_1536.jpg,https://photos.zillowstatic.com/fp/bad065b18f252a2b0eedb6d2b9a8537c-cc_ft_1536.jpg,https://photos.zillowstatic.com/fp/8489ed07f8ad693cb2a616f76c911ce4-cc_ft_1536.jpg,https://photos.zillowstatic.com/fp/1967cba29df1cd151b21d11a619634bd-cc_ft_1536.jpg,https://photos.zillowstatic.com/fp/b87f8111048986048f12832f7feb39a0-cc_ft_1536.jpg,https://photos.zillowstatic.com/fp/8501472f17a7975e8382710614b12d24-cc_ft_1536.jpg,https://photos.zillowstatic.com/fp/c563bb3e5fba049767dfacd2ab25830b-cc_ft_1536.jpg,https://photos.zillowstatic.com/fp/0aa95fbce53e79710f3b240d560721a5-cc_ft_1536.jpg,https://photos.zillowstatic.com/fp/e10c7168f1346ee457425ffca4761284-cc_ft_1536.jpg,https://photos.zillowstatic.com/fp/73e37682380cca82d7e93dc3d201d60c-cc_ft_1536.jpg,https://photos.zillowstatic.com/fp/6ce9bb2377dd3b6823d0ce142bb2a244-cc_ft_1536.jpg,https://photos.zillowstatic.com/fp/b5b31942633a1e6b0dc91dc619de6381-cc_ft_1536.jpg,https://photos.zillowstatic.com/fp/c9ecc8f28c6a9985a79ce0add72da621-cc_ft_1536.jpg,https://photos.zillowstatic.com/fp/75aaa17b5dea20b6d2090b0f3a68cbbe-cc_ft_1536.jpg,https://photos.zillowstatic.com/fp/5255a5514a09efaa86aea3cbea493a7a-cc_ft_1536.jpg,https://photos.zillowstatic.com/fp/b038da3e3781c29a3626c1238d2a357d-cc_ft_1536.jpg,https://photos.zillowstatic.com/fp/2f7c201900464f068c2b278712e00f2f-cc_ft_1536.jpg,https://photos.zillowstatic.com/fp/cd8539096767bfdeb7ae1af05501013f-cc_ft_1536.jpg,https://photos.zillowstatic.com/fp/7f537c1119eac111b30c42c57b7bb00c-cc_ft_1536.jpg,https://photos.zillowstatic.com/fp/8f4bc7759165e6c922938e47a23e10d8-cc_ft_1536.jpg,https://photos.zillowstatic.com/fp/38763cde0caf12411af9b2d942c75c32-cc_ft_1536.jpg,https://photos.zillowstatic.com/fp/a154e5f3fd10a58407341976c278e71a-cc_ft_1536.jpg,https://photos.zillowstatic.com/fp/38f9a01f1e90a916bb27eec213a3503d-cc_ft_1536.jpg,https://photos.zillowstatic.com/fp/8e20d2b06f6adb88f95e5655070a4b32-cc_ft_1536.jpg,https://photos.zillowstatic.com/fp/7ac772c9ae0192062d204981a524af94-cc_ft_1536.jpg,https://photos.zillowstatic.com/fp/27ca7c68fb7e474a207abbe6c0a8137d-cc_ft_1536.jpg,https://photos.zillowstatic.com/fp/d387a1c3a7e6394a5f3b8d37156c1197-cc_ft_1536.jpg,https://photos.zillowstatic.com/fp/f41fa058818d1705acbbd8c728ee764a-cc_ft_1536.jpg,https://photos.zillowstatic.com/fp/807cccdc6c6526238934f48b165a7194-cc_ft_1536.jpg,https://photos.zillowstatic.com/fp/c358c242d225ad273e9ac0ee05d97f69-cc_ft_1536.jpg,https://photos.zillowstatic.com/fp/76dee126fee55840feaf8de992ba088f-cc_ft_1536.jpg,https://photos.zillowstatic.com/fp/fe2472cfa0be798843b41f6c2fabf544-cc_ft_1536.jpg,https://photos.zillowstatic.com/fp/52954f94c4a7f2b734ba5aad7de1d760-cc_ft_1536.jpg,https://photos.zillowstatic.com/fp/bb3b6c764b9c240cbb36fc30886598b0-cc_ft_1536.jpg,https://photos.zillowstatic.com/fp/ff9f24541b8d04d906cf771653568072-cc_ft_1536.jpg,https://photos.zillowstatic.com/fp/257e2b7192321b1494e8d1fb20f1ea1c-cc_ft_1536.jpg,https://photos.zillowstatic.com/fp/53bf2b1a73c55b5b3bc79496c7caf91e-cc_ft_1536.jpg,https://photos.zillowstatic.com/fp/144377b242d3007f811e91c23457aad6-cc_ft_1536.jpg,https://photos.zillowstatic.com/fp/6f224aef1bb46e8c078628f2a2d6da0f-cc_ft_1536.jpg,https://photos.zillowstatic.com/fp/b36182e3bd577c4203961dc4eedbf726-cc_ft_1536.jpg,https://photos.zillowstatic.com/fp/03aee84b107cf198be4140b4c16de75c-cc_ft_1536.jpg,https://photos.zillowstatic.com/fp/3a34e958f964f3690391f211b1a8fad5-cc_ft_1536.jpg,https://photos.zillowstatic.com/fp/2045a2eab791995f04422566e9c80dd6-cc_ft_1536.jpg,https://photos.zillowstatic.com/fp/0a1ac41c6e0edadd2c292a8a4ba78e92-cc_ft_1536.jpg,https://photos.zillowstatic.com/fp/f01af59b1d1f631e3e2b7a90ea09663f-cc_ft_1536.jpg,https://photos.zillowstatic.com/fp/c4ae9b02a88546f1115ec434a4bb33ac-cc_ft_1536.jpg,https://photos.zillowstatic.com/fp/72216456704beca9f962af65f8223306-cc_ft_1536.jpg,https://photos.zillowstatic.com/fp/53548a1d386fbaf8e059ca06b7d1f1f4-cc_ft_1536.jpg,https://photos.zillowstatic.com/fp/b9bc06b4933fbcc244afabd19888dbe1-cc_ft_1536.jpg,https://photos.zillowstatic.com/fp/161670b2302d960efda8520e3dcdf95b-cc_ft_1536.jpg,https://photos.zillowstatic.com/fp/644ce2f05e1a78d64972b8984f231851-cc_ft_1536.jpg,https://photos.zillowstatic.com/fp/c2239703b43965a1a61fdabceb9853ef-cc_ft_1536.jpg,San Francisco,CA,881 Corbett Ave #3,94131,https://photos.zillowstatic.com/fp/3dfa9079eac636d479578a0317e16790-cc_ft_1536.jpg,https://photos.zillowstatic.com/fp/99e26dd0d42a0a969577648cb1e91a7c-cc_ft_1536.jpg,https://photos.zillowstatic.com/fp/16832750791bbb6d9abad0b386196d88-cc_ft_1536.jpg,https://photos.zillowstatic.com/fp/a1672f573df68bdb6f3feaf21f635d3f-cc_ft_1536.jpg,https://photos.zillowstatic.com/fp/2085ae5364a56be0d4937cca29755e96-cc_ft_1536.jpg,https://photos.zillowstatic.com/fp/43fa45849976626d212ec2060ff06345-cc_ft_1536.jpg,https://photos.zillowstatic.com/fp/759013c1927747208ebc3b991df35f8d-cc_ft_1536.jpg,https://photos.zillowstatic.com/fp/839210d94a44f54547efb946c7189d89-cc_ft_1536.jpg,https://photos.zillowstatic.com/fp/e61a3242b90a49e9cc6aaff5d5825135-cc_ft_1536.jpg,https://photos.zillowstatic.com/fp/94358b9951a46626f66787b3e019d7f1-cc_ft_1536.jpg,https://photos.zillowstatic.com/fp/cec84ecc960bb4bd2f93d16c14e72a74-cc_ft_1536.jpg,https://photos.zillowstatic.com/fp/080bd05b9cc694ec370a4442fd9f8bda-cc_ft_1536.jpg,https://photos.zillowstatic.com/fp/271c7fec180e3276c92c257cfc51557a-cc_ft_1536.jpg,https://photos.zillowstatic.com/fp/7fac77fc9e62069fc16493f0ddb2d420-cc_ft_1536.jpg,https://photos.zillowstatic.com/fp/729d74ba0c5a187d638838537bac3036-cc_ft_1536.jpg,https://photos.zillowstatic.com/fp/ae0b7a5f823c11778b23f62f4c0edd7f-cc_ft_1536.jpg,https://photos.zillowstatic.com/fp/78071d1fd2c24b7654c3b8a0997ad0f9-cc_ft_1536.jpg,https://photos.zillowstatic.com/fp/900382538da02ba0f4afead989794148-cc_ft_1536.jpg,https://photos.zillowstatic.com/fp/37e34e9d7ca00d305cf121374f617376-cc_ft_1536.jpg,https://photos.zillowstatic.com/fp/3c33d6ddf179795b2a51927800953847-cc_ft_1536.jpg,https://photos.zillowstatic.com/fp/bd021cefb2ea93d61d1967d1487e22a2-cc_ft_1536.jpg,https://photos.zillowstatic.com/fp/c1aa93c375450f0fbcb6f815179ea3fd-cc_ft_1536.jpg,,,,,,,,,,
15149191,https://www.zillow.com/homedetails/582-Alabama-St-San-Francisco-CA-94110/15149191_zpid/,1050,2,2,https://photos.zillowstatic.com/fp/3a6b810f9bdd9bb11ba846e0d4008db3-cc_ft_1536.jpg,1100000,San Francisco County,SOLD,USD,TOWNHOUSE,37.76186,Paul Hwang,-122.412254,1999,582 Alabama St,paul@skyboxrealty.com,Skybox Realty,"Amazing 4 level Mission designer remodel Townhouse with private entrance, private terrace & private garage with interior access across from Tartine Manufactory! Elegantly appointed and newly remodeled with modern smart home conveniences. Light-filled top floor master with vaulted ceilings opens to a private patio with city views. Ensuite bathroom, 2 closets, and an extra loft area complete the room. The middle level features an updated open concept kitchen/dining and living area with custom cabinetry, stainless steel appliances and bespoke light fixtures. The 1st level is home to the 2nd bedroom & bath. Interior access to private garage with washer/dryer. Smart home with Lutron light switches and Nest thermostats. The driveway can also be blocked for a second parking spot. Prime Mission location across the street from Tartine Manufactory and Heath Ceramics. Close walk to restaurants, bars, Gus's supermarket and all the Mission and SF have to offer. Close to public transport/freeways.",953,415-216-8746,415-216-8746,San Francisco,San Francisco,San Francisco,,,https://photos.zillowstatic.com/fp/3a6b810f9bdd9bb11ba846e0d4008db3-cc_ft_1536.jpg,https://photos.zillowstatic.com/fp/9f8e3ef2b25cdf11f2e450a7588fefe4-cc_ft_1536.jpg,https://photos.zillowstatic.com/fp/392f58ec83de517af644bdaebfccb6a7-cc_ft_1536.jpg,https://photos.zillowstatic.com/fp/569d03015ce90f9bf78fc67b788e590b-cc_ft_1536.jpg,https://photos.zillowstatic.com/fp/e417aa2207e8ce41864ecda86f298f23-cc_ft_1536.jpg,https://photos.zillowstatic.com/fp/3bdd69e7ce2d841414d06d93fae333dc-cc_ft_1536.jpg,https://photos.zillowstatic.com/fp/c361d27b720cca90f883017561177337-cc_ft_1536.jpg,https://photos.zillowstatic.com/fp/a5299e31b933c60e7a5f80ea9326b5de-cc_ft_1536.jpg,https://photos.zillowstatic.com/fp/0303ca29b0066a5a95f1cb1475674360-cc_ft_1536.jpg,https://photos.zillowstatic.com/fp/4e0434c6c86d4fe662548a24f1b7ae0a-cc_ft_1536.jpg,https://photos.zillowstatic.com/fp/5fe40e75f2cedd64987540fa0fa9abcd-cc_ft_1536.jpg,https://photos.zillowstatic.com/fp/fa86eacbf1c5cb7136fd321764aeea8c-cc_ft_1536.jpg,https://photos.zillowstatic.com/fp/e61ae09564dcff48b54081dc95e8aaaa-cc_ft_1536.jpg,https://photos.zillowstatic.com/fp/82aa03de9f97c80b15324c2f706ca07c-cc_ft_1536.jpg,https://photos.zillowstatic.com/fp/e816bc1553bfefd1a501b91ca9415810-cc_ft_1536.jpg,https://photos.zillowstatic.com/fp/fc0cac5c2a3968b18730bcf6f5a4aa2b-cc_ft_1536.jpg,https://photos.zillowstatic.com/fp/00e54193ac56fc2016bb682dd9099109-cc_ft_1536.jpg,https://photos.zillowstatic.com/fp/da496118038a198ec1d527340b4553b2-cc_ft_1536.jpg,https://photos.zillowstatic.com/fp/75d370530b09d91991e5490f6491351d-cc_ft_1536.jpg,https://photos.zillowstatic.com/fp/3c8145112cdd8070481e4fd55dde29c7-cc_ft_1536.jpg,https://photos.zillowstatic.com/fp/a734deef2277ae60c31ce1189f0b5c06-cc_ft_1536.jpg,https://photos.zillowstatic.com/fp/6ee9af9e3f6956458317def5730284de-cc_ft_1536.jpg,https://photos.zillowstatic.com/fp/6f9d7607acff82e9447e07f431aa9681-cc_ft_1536.jpg,https://photos.zillowstatic.com/fp/a06b65e5c361abfd18f56b31b0e37b9e-cc_ft_1536.jpg,https://photos.zillowstatic.com/fp/e6426fb2c18cc2d2eab212f3e1559a20-cc_ft_1536.jpg,https://photos.zillowstatic.com/fp/240339c4b4b978884b36d7324e3a4add-cc_ft_1536.jpg,https://photos.zillowstatic.com/fp/c32542392ff28656a5d814652ac7286b-cc_ft_1536.jpg,https://photos.zillowstatic.com/fp/9b7cd8745920473789a3655259e4706f-cc_ft_1536.jpg,https://photos.zillowstatic.com/fp/693315df49652418e3e25f26aed71758-cc_ft_1536.jpg,https://photos.zillowstatic.com/fp/2090a73a49d7be12c454d3034eb77872-cc_ft_1536.jpg,https://photos.zillowstatic.com/fp/f7d678c314e2d609c9e16593958bf030-cc_ft_1536.jpg,https://photos.zillowstatic.com/fp/3e7bf9837485dc3c04da1571d1288b99-cc_ft_1536.jpg,https://photos.zillowstatic.com/fp/28c6f906c20a481729524b7d3bd0de87-cc_ft_1536.jpg,https://photos.zillowstatic.com/fp/2487a57e7488287797b6184331a34400-cc_ft_1536.jpg,https://photos.zillowstatic.com/fp/b7980d601e05ad0312dc612edb7a7066-cc_ft_1536.jpg,https://photos.zillowstatic.com/fp/262e3e838abe29814eb84ceafab61519-cc_ft_1536.jpg,,,,,,,,,,,,,,,,,,,,,San Francisco,CA,582 Alabama St,94110,,,,,,,,,,,,,,,,,,,,,,,,,,,,,,,,
2077825472,https://www.zillow.com/homedetails/271-Shipley-St-UNIT-F-6-San-Francisco-CA-94107/2077825472_zpid/,808,2,1,https://photos.zillowstatic.com/fp/bcd79faf425ea6c0977af4605525229d-cc_ft_1536.jpg,789000,San Francisco County,SOLD,USD,TOWNHOUSE,37.778576,Michelle K. Pender,-122.40415,1993,271 Shipley St UNIT F-6,michelle.pender@evrealestate.com,Compass,"Welcome home to 271 Shipley, an urban dweller's sanctuary, located in the heart of vibrant SOMA yet tucked away on a slower-paced street.  This sleek town-home-like condo is drenched in natural sunlight and boasts 3 levels of private and functional living spaces.Tastefully updated, this home boasts vaulted ceilings, skylights, big windows, impressive hardwood floors, and high-quality finishes. Designed for entertaining, the main living level includes an open concept floor plan, and private deck perfect for your morning coffee ritual. Enjoy intimate home-cooked meals with loved ones, and indulge in a glass of wine with friends in front of your modern, wood-burning fireplace on a crisp San Francisco evening. The modern, utilitarian chef's kitchen makes cooking fun and is complete with chic appliances, sleek quartz countertops, and ample cabinet space.",955,415-283-6983,415-738-7000,San Francisco,San Francisco,San Francisco,,,https://photos.zillowstatic.com/fp/bcd79faf425ea6c0977af4605525229d-cc_ft_1536.jpg,https://photos.zillowstatic.com/fp/3b94d06fc37240f31ee414b0b45335c5-cc_ft_1536.jpg,https://photos.zillowstatic.com/fp/1e8e0c5118b876d3749a3244dd52cbef-cc_ft_1536.jpg,https://photos.zillowstatic.com/fp/a5addfaaaa0dd3c355474ccedbbeeec5-cc_ft_1536.jpg,https://photos.zillowstatic.com/fp/28f7d8b7b80066deaca2487d7d162f6b-cc_ft_1536.jpg,https://photos.zillowstatic.com/fp/912615a60bea8e82a4c76df9e33d8eea-cc_ft_1536.jpg,https://photos.zillowstatic.com/fp/5e40a9132249ea7e921f7ff8aa506319-cc_ft_1536.jpg,https://photos.zillowstatic.com/fp/5266614830a33f291bbaeb359a89790e-cc_ft_1536.jpg,https://photos.zillowstatic.com/fp/12eb3ae32f56653082200a45c1eda5a5-cc_ft_1536.jpg,https://photos.zillowstatic.com/fp/9416fd9a63e123a45425320d46eff03c-cc_ft_1536.jpg,https://photos.zillowstatic.com/fp/804eea3c86643d5f2308110339321908-cc_ft_1536.jpg,https://photos.zillowstatic.com/fp/4dd3228101df7926bb841fb886ef00c3-cc_ft_1536.jpg,https://photos.zillowstatic.com/fp/601f1afde52c06f96d1125464e2b0ca2-cc_ft_1536.jpg,https://photos.zillowstatic.com/fp/c9530a830df46bc018cdaf52ca544547-cc_ft_1536.jpg,https://photos.zillowstatic.com/fp/446629078f7af7842637b685c329663f-cc_ft_1536.jpg,https://photos.zillowstatic.com/fp/0b7ee57fb8818f125b1445dcf1f6e823-cc_ft_1536.jpg,https://photos.zillowstatic.com/fp/f1e258f4e0d9bcd39873e8a4533b6005-cc_ft_1536.jpg,https://photos.zillowstatic.com/fp/2af0d42ab4e8350f226ae1289092a322-cc_ft_1536.jpg,https://photos.zillowstatic.com/fp/3f5c3ad35a6a0b57c216aba17a6bd98f-cc_ft_1536.jpg,https://photos.zillowstatic.com/fp/5c7aadbb8b3cac04e68750ca661148f5-cc_ft_1536.jpg,https://photos.zillowstatic.com/fp/752cc678b88cfd93efae03eaa949b88b-cc_ft_1536.jpg,https://photos.zillowstatic.com/fp/6ddf68bee3a3ae409b287bd15c4b532f-cc_ft_1536.jpg,https://photos.zillowstatic.com/fp/71954a1f57a2a6922079a6523d42ce8e-cc_ft_1536.jpg,https://photos.zillowstatic.com/fp/d12db3e40444ffc73970a4a072c036bd-cc_ft_1536.jpg,https://photos.zillowstatic.com/fp/88968fd1468537188a8dd6d6507a2c78-cc_ft_1536.jpg,https://photos.zillowstatic.com/fp/3a10cd3e8e8078bab8a6ab18b9b02cc5-cc_ft_1536.jpg,https://photos.zillowstatic.com/fp/1d62f262ac0e9b68b06a8398739f0ffe-cc_ft_1536.jpg,https://photos.zillowstatic.com/fp/420045649ee975b00f0f050a384003d6-cc_ft_1536.jpg,https://photos.zillowstatic.com/fp/21a1339de7b3441c21c9df7f10cb2132-cc_ft_1536.jpg,https://photos.zillowstatic.com/fp/cc7a65dec38d7c8b665d1a22215ee022-cc_ft_1536.jpg,https://photos.zillowstatic.com/fp/4cbf211aaee6448be1be113f803e8509-cc_ft_1536.jpg,https://photos.zillowstatic.com/fp/5ea77c34e0ec1058a1a230c0b70bda79-cc_ft_1536.jpg,https://photos.zillowstatic.com/fp/a3d4562e1418eb7c6068e7b1e98f857a-cc_ft_1536.jpg,https://photos.zillowstatic.com/fp/713e8accd11165d2ee541ce40c9ed607-cc_ft_1536.jpg,https://photos.zillowstatic.com/fp/c3577cfab5b73b1a0463c7ea66b00fcd-cc_ft_1536.jpg,,,,,,,,,,,,,,,,,,,,,,San Francisco,CA,271 Shipley St UNIT F-6,94107,,,,,,,,,,,,,,,,,,,,,,,,,,,,,,,,
184766087,https://www.zillow.com/homedetails/556-Hudson-Ave-San-Francisco-CA-94124/184766087_zpid/,1527,3,2,"https://maps.googleapis.com/maps/api/staticmap?mobile=false&sensor=true&maptype=satellite&size=1536x1152&zoom=17&center=37.72917175292969,-122.36866760253906&key=AIzaSyBJsNQO5ZeG-XAbqqWLKwG08fWITSxg33w&&signature=_-jXEnN4zInij9HoI6SNfhuEkrk=",1180000,San Francisco County,SOLD,USD,TOWNHOUSE,37.72917,,-122.36867,2019,556 Hudson Ave,,,"556 Hudson Ave, San Francisco, CA 94124 is a townhome home that contains 1,527 sq ft and was built in 2019. It contains 3 bedrooms and 2 bathrooms. This home last sold for $1,180,000 in December 2020. 
 
The Zestimate for this house is $1,062,800. The Rent Zestimate for this home is $4,500/mo.",958,,,,,,,,"https://maps.googleapis.com/maps/api/staticmap?mobile=false&sensor=true&maptype=satellite&size=1536x1152&zoom=17&center=37.72917175292969,-122.36866760253906&key=AIzaSyBJsNQO5ZeG-XAbqqWLKwG08fWITSxg33w&&signature=_-jXEnN4zInij9HoI6SNfhuEkrk=",,,,,,,,,,,,,,,,,,,,,,,,,,,,,,,,,,,,,,,,,,,,,,,,,,,,,,,,San Francisco,CA,556 Hudson Ave,94124,,,,,,,,,,,,,,,,,,,,,,,,,,,,,,,,
2077161197,https://www.zillow.com/homedetails/1933-Divisadero-St-APT-3D-San-Francisco-CA-94115/2077161197_zpid/,1940,3,3,https://photos.zillowstatic.com/fp/f904f963609c5f4d30366cbbe9b7f14e-cc_ft_1536.jpg,2400000,San Francisco County,SOLD,USD,TOWNHOUSE,37.787655,Peter A. Chovanes,-122.4409,2012,1933 Divisadero St APT 3D,pchovanes@gmail.com,Berkshire Hathaway Drysdale Pr,"This stunning townhome is located on the quiet back side of Divisadero.  Using only the finest materials this modern home has 3 levels of living space.  From the moment you enter the foyer you will be greeted by the reverse floor plan.  Located on level 1 is the washer/dryer closet a beautiful hall bath a guest room, plus the primary suite complete with walk-in closet, soaking tub and plantation shutters.  Level 2 consists of a third bedroom currently being used as a home gym, a full bath and the main living areas.  On the third level is a stunning walk out private terrace complete with plumbed-in fire pit and stunning views.   This townhouse has extensive use of custom lighting, and designer appliances including Fanamation lighting, La Toscana faucetry, Bertazzoni range, SoZo Studio cabinetry, Liebherr refrigerator freezer plus custom brick and tile applications throughout.  This home comes with parking for 2 cars, a large storage area, and a 220V electric charging outlet.",960,415-517-7667,415-655-9007,San Francisco,San Francisco,San Francisco,,,https://photos.zillowstatic.com/fp/f904f963609c5f4d30366cbbe9b7f14e-cc_ft_1536.jpg,https://photos.zillowstatic.com/fp/59017021f248baf0b7aeaaa21faf0066-cc_ft_1536.jpg,https://photos.zillowstatic.com/fp/d467d7f8201357f7ea47df18a22be1da-cc_ft_1536.jpg,https://photos.zillowstatic.com/fp/4e1305e61728664fdd50678a98d4f758-cc_ft_1536.jpg,https://photos.zillowstatic.com/fp/6a302ed63a7d1eed4b3accf458ac5e8b-cc_ft_1536.jpg,https://photos.zillowstatic.com/fp/dd3ceb44884c5be597e0d345f35f0dde-cc_ft_1536.jpg,https://photos.zillowstatic.com/fp/28e10406819c4d05c3b0a4cd01961dbf-cc_ft_1536.jpg,https://photos.zillowstatic.com/fp/bd908c39e449b5e4ec012e1cabe50ff6-cc_ft_1536.jpg,https://photos.zillowstatic.com/fp/1398cc0b5a836380cfc74d761e59c377-cc_ft_1536.jpg,https://photos.zillowstatic.com/fp/714f4ea75d4fbce751ccd89f7e436b09-cc_ft_1536.jpg,https://photos.zillowstatic.com/fp/907c9c124ffdeb50605da673d5510bfd-cc_ft_1536.jpg,https://photos.zillowstatic.com/fp/d1deb6a37a0f353301a25a3056271581-cc_ft_1536.jpg,https://photos.zillowstatic.com/fp/4da7f0024eb15045615681b0da3c2c46-cc_ft_1536.jpg,https://photos.zillowstatic.com/fp/db567a9ff501c1920bf5b22af828dbbf-cc_ft_1536.jpg,https://photos.zillowstatic.com/fp/fb4f22bc1b012d257453fae1fe60d53f-cc_ft_1536.jpg,https://photos.zillowstatic.com/fp/592d17bda3dd45afbe2ec29c9a81aa3e-cc_ft_1536.jpg,https://photos.zillowstatic.com/fp/2ee2952097658f72cd15700e44a21f98-cc_ft_1536.jpg,https://photos.zillowstatic.com/fp/ab327bdd368cde14d161a8300631d5be-cc_ft_1536.jpg,https://photos.zillowstatic.com/fp/4173961b9e3d24aede579d4caed0ce23-cc_ft_1536.jpg,https://photos.zillowstatic.com/fp/31373aa7a30a0b0972b362b787712a11-cc_ft_1536.jpg,https://photos.zillowstatic.com/fp/61183a97928e27e1d629995a23c284b5-cc_ft_1536.jpg,https://photos.zillowstatic.com/fp/6bc12ac413aef6b29e0bcb6bc90010ac-cc_ft_1536.jpg,https://photos.zillowstatic.com/fp/a81348e152468b3966b717656e8b7f46-cc_ft_1536.jpg,https://photos.zillowstatic.com/fp/7ae138c6cc431280d814d0f1349aa41b-cc_ft_1536.jpg,https://photos.zillowstatic.com/fp/fa39b117d178c27f0a377d23dc6d67dd-cc_ft_1536.jpg,https://photos.zillowstatic.com/fp/c47e51550415e435ee4670e6b43fa40f-cc_ft_1536.jpg,https://photos.zillowstatic.com/fp/2072a2d7ff8625e1c985f6ed2b2875df-cc_ft_1536.jpg,https://photos.zillowstatic.com/fp/3371af18af48c05037159127b8e2c540-cc_ft_1536.jpg,https://photos.zillowstatic.com/fp/5ea50189927d60b18e9a199b99c4bff9-cc_ft_1536.jpg,https://photos.zillowstatic.com/fp/1938ea3ff8537ff4f7b77cb729d9fd28-cc_ft_1536.jpg,https://photos.zillowstatic.com/fp/7a25396650c9892ad4b784aff487f711-cc_ft_1536.jpg,https://photos.zillowstatic.com/fp/12510aeed455b9eb9ccb74bdefa007c6-cc_ft_1536.jpg,https://photos.zillowstatic.com/fp/11db1153e2c07722c3206890ad3adf08-cc_ft_1536.jpg,https://photos.zillowstatic.com/fp/c5a6615b40c8052f400cae208937e3a6-cc_ft_1536.jpg,https://photos.zillowstatic.com/fp/a9d3d5e04511c9c81a32ba83dda33768-cc_ft_1536.jpg,https://photos.zillowstatic.com/fp/6b71bc39aac56417473920fa351f2f3d-cc_ft_1536.jpg,https://photos.zillowstatic.com/fp/7b6e594d82cd0009d2e73709557dd903-cc_ft_1536.jpg,https://photos.zillowstatic.com/fp/b36f7abd168d5689d3429314c486118c-cc_ft_1536.jpg,https://photos.zillowstatic.com/fp/e1741ff1752b01fda6b17b853c9097f6-cc_ft_1536.jpg,https://photos.zillowstatic.com/fp/368a260026fe4ba1b220235c22d5c21e-cc_ft_1536.jpg,https://photos.zillowstatic.com/fp/e6e163db0a61ee8e76a0a2ba9888a044-cc_ft_1536.jpg,https://photos.zillowstatic.com/fp/ce66454e8568655c17a9b4060fd3a948-cc_ft_1536.jpg,https://photos.zillowstatic.com/fp/0c38661213f25aedaf8afe66c2885432-cc_ft_1536.jpg,https://photos.zillowstatic.com/fp/562deb7bc32abe4d0bd0ce1165e27692-cc_ft_1536.jpg,https://photos.zillowstatic.com/fp/cfc2daa5e24f41510fbf01425b0d7e2b-cc_ft_1536.jpg,https://photos.zillowstatic.com/fp/d588d3f55e5867e9551e3049886e4e62-cc_ft_1536.jpg,https://photos.zillowstatic.com/fp/d251da570a3668a8745fca0da52b1a39-cc_ft_1536.jpg,https://photos.zillowstatic.com/fp/064e63149724ad3f47fb0d97452483aa-cc_ft_1536.jpg,https://photos.zillowstatic.com/fp/baa5c43b3dfa4ac115a4f38f3e4ed453-cc_ft_1536.jpg,https://photos.zillowstatic.com/fp/4334498197b89415e0fe660cc30f7224-cc_ft_1536.jpg,https://photos.zillowstatic.com/fp/98849f87d1ba3c8e1db9b5d518dce19a-cc_ft_1536.jpg,https://photos.zillowstatic.com/fp/3f33cb3f79fb222a18767bd6182c97e3-cc_ft_1536.jpg,https://photos.zillowstatic.com/fp/83d76ec0eccde5aa7f5d5fbb58acf2db-cc_ft_1536.jpg,https://photos.zillowstatic.com/fp/ace823ae446544b6ae07f6d37c594f21-cc_ft_1536.jpg,https://photos.zillowstatic.com/fp/c0677a3107b30a1e02811d4fb32c1d42-cc_ft_1536.jpg,https://photos.zillowstatic.com/fp/6b44fda98de4a649f55fa4465e118c0f-cc_ft_1536.jpg,San Francisco,CA,1933 Divisadero St APT 3D,94115,https://photos.zillowstatic.com/fp/8ede4329adc54d92fd33fdc075a66d7a-cc_ft_1536.jpg,https://photos.zillowstatic.com/fp/6f9c00c77585a49142e6d24ed9166419-cc_ft_1536.jpg,https://photos.zillowstatic.com/fp/1c47d549a99bbbb07321b2ed0f26271a-cc_ft_1536.jpg,https://photos.zillowstatic.com/fp/46bdbc5a73198a9d7c60bceaa223476f-cc_ft_1536.jpg,https://photos.zillowstatic.com/fp/ffdf6e3ba7a47a2a44039baf1f6fbf3c-cc_ft_1536.jpg,https://photos.zillowstatic.com/fp/59b44bba5659ad6ee0a892cb6a38b7f6-cc_ft_1536.jpg,https://photos.zillowstatic.com/fp/7ba7cc25835f343d2bd22b608e836403-cc_ft_1536.jpg,https://photos.zillowstatic.com/fp/2da1b7bc17b5ff1f6d9e29a434c48bb3-cc_ft_1536.jpg,https://photos.zillowstatic.com/fp/1d2b9a8853b2d5d5467807a08a0f25e1-cc_ft_1536.jpg,https://photos.zillowstatic.com/fp/f270be0e941cb7c90ea007946e901335-cc_ft_1536.jpg,,,,,,,,,,,,,,,,,,,,,,
