15130120,https://www.zillow.com/homedetails/684-Clarendon-Ave-San-Francisco-CA-94131/15130120_zpid/,1485,2,3,https://photos.zillowstatic.com/fp/41e042b4cacf568c3caa3e1040160c6f-cc_ft_1536.jpg,1350000,San Francisco County,SOLD,USD,TOWNHOUSE,37.75213,Victor Tran,-122.4583,1977,684 Clarendon Ave,vic@kineticrealestate.com,Ascend Real Estate,"Tucked in between Forest Knolls and Forest Hill, you will find this gated-community townhome surrounded by lush greenery and calmness, perfect for those looking to escape the rustle and bustle of the City. The main level offers an expansive living room complete w/ fireplace and private deck, an open kitchen/dining room floor plan, and a powder room. On the top floor, you will find two light-filled, large bedrooms each w/ separate baths, along with the laundry room which is conveniently located on the top floor. For those seeking spa-like features, the primary bath also includes a steam shower! The community also offers a sauna, gym, and clubhouse. A 2-car garage w/ loads of storage complete this residence that is within walking distance to Forest Hill Station. All your shops, restaurants, and cafes needs can be found within a 10-minute bike ride to both Inner Sunset or West Portal. ForestKnollsTownHome.com",689,415-390-6255,415-347-5669,,,,,,https://photos.zillowstatic.com/fp/41e042b4cacf568c3caa3e1040160c6f-cc_ft_1536.jpg,,,,,,,,,,,,,,,,,,,,,,,,,,,,,,,,,,,,,,,,,,,,,,,,,,,,,,,,San Francisco,CA,684 Clarendon Ave,94131,,,,,,,,,,,,,,,,,,,,,,,,,,,,,,,,
184766093,https://www.zillow.com/homedetails/580-Hudson-Ave-San-Francisco-CA-94124/184766093_zpid/,1634,3,2,"https://maps.googleapis.com/maps/api/staticmap?mobile=false&sensor=true&maptype=satellite&size=1536x1152&zoom=17&center=37.729408264160156,-122.36907958984375&key=AIzaSyBJsNQO5ZeG-XAbqqWLKwG08fWITSxg33w&&signature=greITmXZKAGXpokwXOBhI7haCaw=",1270000,San Francisco County,SOLD,USD,TOWNHOUSE,37.72941,,-122.36908,2020,580 Hudson Ave,,,"580 Hudson Ave, San Francisco, CA 94124 is a townhome home that contains 1,634 sq ft and was built in 2020. It contains 3 bedrooms and 2 bathrooms. This home last sold for $1,270,000 in September 2021. 
 
The Zestimate for this house is $1,127,500. The Rent Zestimate for this home is $4,700/mo.",694,,,,,,,,"https://maps.googleapis.com/maps/api/staticmap?mobile=false&sensor=true&maptype=satellite&size=1536x1152&zoom=17&center=37.729408264160156,-122.36907958984375&key=AIzaSyBJsNQO5ZeG-XAbqqWLKwG08fWITSxg33w&&signature=greITmXZKAGXpokwXOBhI7haCaw=",,,,,,,,,,,,,,,,,,,,,,,,,,,,,,,,,,,,,,,,,,,,,,,,,,,,,,,,San Francisco,CA,580 Hudson Ave,94124,,,,,,,,,,,,,,,,,,,,,,,,,,,,,,,,
184818352,https://www.zillow.com/homedetails/216-Friedell-St-San-Francisco-CA-94124/184818352_zpid/,1505,2,2,https://photos.zillowstatic.com/fp/586c246e54a37e692810423a586e06c2-cc_ft_1536.jpg,785000,San Francisco County,SOLD,USD,TOWNHOUSE,37.728382,Lorraine Meier,-122.3702,2016,216 Friedell St,lorraine@novabayarea.com,Nova Real Estate,"Don't miss this inviting, modern townhome that lives like a single family home at The Shipyard.  This pristine home features an open floor plan with high ceilings and a dramatic sunken living room, sleek and modern finishes including a gourmet kitchen with chef's appliances and breakfast bar downstairs. Upstairs you will find  2 large bedrooms / two full baths and spacious closets. Main bedroom w/en suite bath. 1 car parking in a private garage with a large storage room and gated driveway. Perfect opportunity for owners and investors alike. Low HOA: $284 per month. Close to parks and steps from the India Basin Park project slated to be completed 2025- 64 acres of open space and a chain of parks linking 1.7 miles of southeastern  shoreline. Explore the neighborhood ibwaterfrontparks.com and indiabasin.org",696,415-596-9362,415-601-6915,,,,,,https://photos.zillowstatic.com/fp/586c246e54a37e692810423a586e06c2-cc_ft_1536.jpg,https://photos.zillowstatic.com/fp/4fe23e78dbe3cd6cd630d310bfa7dbb4-cc_ft_1536.jpg,https://photos.zillowstatic.com/fp/75d1ea8ad614f5a74fc68f8c99cbad52-cc_ft_1536.jpg,https://photos.zillowstatic.com/fp/2ec32654fe53859871690c8b641f99b2-cc_ft_1536.jpg,https://photos.zillowstatic.com/fp/36c63704beb879293b4ea485db8d5b05-cc_ft_1536.jpg,https://photos.zillowstatic.com/fp/1f38eb94aa33430e47ab701e9cf8f82d-cc_ft_1536.jpg,https://photos.zillowstatic.com/fp/f41bd55a309744d93648d9c9c0074dec-cc_ft_1536.jpg,https://photos.zillowstatic.com/fp/1b7d887d76c0fe4eea0ec159b2f344bf-cc_ft_1536.jpg,https://photos.zillowstatic.com/fp/166e90f7e0aeb4f84df88f48d5ef2a67-cc_ft_1536.jpg,https://photos.zillowstatic.com/fp/d7906533b35e005553baa9caf7fb09b4-cc_ft_1536.jpg,https://photos.zillowstatic.com/fp/087e4af0220dfaf5017d4b81ee68be99-cc_ft_1536.jpg,https://photos.zillowstatic.com/fp/8698c315833ecfc9c44dab7977c1ffe8-cc_ft_1536.jpg,https://photos.zillowstatic.com/fp/f055e38cc157572823680ff271aa7490-cc_ft_1536.jpg,https://photos.zillowstatic.com/fp/942c4a0e309cf2af5ce2e40a066ab6c5-cc_ft_1536.jpg,https://photos.zillowstatic.com/fp/f0a294fb48499fda036a810744fa32ad-cc_ft_1536.jpg,https://photos.zillowstatic.com/fp/1bf5f25e977d58eef98a7404710505eb-cc_ft_1536.jpg,https://photos.zillowstatic.com/fp/71c625ea6104b59c649d8f2d3b8a1c19-cc_ft_1536.jpg,https://photos.zillowstatic.com/fp/b1f27d366dce2403cfada946eaa75960-cc_ft_1536.jpg,https://photos.zillowstatic.com/fp/ce0957495ace996498731e4074855816-cc_ft_1536.jpg,https://photos.zillowstatic.com/fp/645ae89f65d2d9ca6b88a03f7b0a3e14-cc_ft_1536.jpg,https://photos.zillowstatic.com/fp/660445c29cd1a5eb7fca44345e9b1949-cc_ft_1536.jpg,https://photos.zillowstatic.com/fp/3ae74d92e9c26b18608db93d91802e07-cc_ft_1536.jpg,https://photos.zillowstatic.com/fp/aa6b10f5207fb1025f307e2cfc00cb68-cc_ft_1536.jpg,https://photos.zillowstatic.com/fp/6ccc27d282b612f4e39a0d3c462b6869-cc_ft_1536.jpg,https://photos.zillowstatic.com/fp/cb761e1587ad98df7e14647b3a3e1bc6-cc_ft_1536.jpg,https://photos.zillowstatic.com/fp/b12a4cc9cc55abc0efea8ad02a3f8b6a-cc_ft_1536.jpg,https://photos.zillowstatic.com/fp/379fdfdbdcc1b7d7100d9776dee18b41-cc_ft_1536.jpg,https://photos.zillowstatic.com/fp/f57f63dd69d81d9c860bc41ad652e79a-cc_ft_1536.jpg,https://photos.zillowstatic.com/fp/a5ec109533891ccbb721929630473b17-cc_ft_1536.jpg,https://photos.zillowstatic.com/fp/0fd618b2472d323c7485bfd0e72032e8-cc_ft_1536.jpg,https://photos.zillowstatic.com/fp/0b3360bdad0ec69909ca1b2bfe684b2e-cc_ft_1536.jpg,https://photos.zillowstatic.com/fp/f9104a328b28bebb137a0d8143247d9b-cc_ft_1536.jpg,https://photos.zillowstatic.com/fp/b9ebf3bb4f2c4f744296ef295a18534b-cc_ft_1536.jpg,https://photos.zillowstatic.com/fp/f41662cfb250408f787806072690ad75-cc_ft_1536.jpg,,,,,,,,,,,,,,,,,,,,,,,San Francisco,CA,216 Friedell St,94124,,,,,,,,,,,,,,,,,,,,,,,,,,,,,,,,
241586458,https://www.zillow.com/homedetails/175-Avocet-Way-San-Francisco-CA-94124/241586458_zpid/,1415,3,3,https://photos.zillowstatic.com/fp/518b2da14e0540fc9d76f54b3df98386-cc_ft_1536.jpg,990000,San Francisco County,SOLD,USD,TOWNHOUSE,37.72845,Alexandr Metlinski,-122.368675,2016,175 Avocet Way,,NOVO,"Welcome to this Modern/High-Tech Tides Collection Townhome nestled on a quiet street away from the main road. This townhome has a private garage with two-car parking spaces, lots of extra storage, and a private backyard. The first floor has one bedroom with a separate half bathroom. The light-filled second level is devoted to an open-plan kitchen, dining area, large living room with access to an expansive patio, ideal for study, relaxing, or entertaining. The spacious kitchen has stainless steel appliances and a movable bar-top island which might be customizable for any event. The open concept floor plan offers free-flowing usable space across all levels. On the top level are the two bedrooms, each with its separate bathroom. At the top of the stairs, you'll find a new washer/dryer on your way to the two other bedrooms, designed to maximize livability.   Innes Court Park and Overlook Point are within walking distance. Here you will find many outdoor areas and local a",700,,415-447-2000,,,,,,https://photos.zillowstatic.com/fp/518b2da14e0540fc9d76f54b3df98386-cc_ft_1536.jpg,,,,,,,,,,,,,,,,,,,,,,,,,,,,,,,,,,,,,,,,,,,,,,,,,,,,,,,,San Francisco,CA,175 Avocet Way,94124,,,,,,,,,,,,,,,,,,,,,,,,,,,,,,,,
241586492,https://www.zillow.com/homedetails/299-Friedell-St-San-Francisco-CA-94124/241586492_zpid/,1615,3,3,https://photos.zillowstatic.com/fp/58fc340dd397d81d24d0dc7ed485cba7-cc_ft_1536.jpg,970000,San Francisco County,SOLD,USD,TOWNHOUSE,37.728138,Joshua A Lawrence,-122.369774,0,299 Friedell St,,Compass,"Amazing Townhome in The Shipyard!! Get a bigger home now for less than the new models!! This light filled, spacious corner residence boasts soaring ceilings, a private garden and a fantastic floor plan with approximately 1,615 sq.ft. of designer living space! Large great room, opens to a huge private terrace and chef's kitchen w/stainless steel appliances, quartz countertops and bar-top island. Newly constructed in 2016, this home showcases energy efficient features including double pane windows, NEST thermostats and views! Also included, in-home washer and dryer and oversized 2-car garage w/storage! HOA is $318.38/month",706,,,,,,,,https://photos.zillowstatic.com/fp/58fc340dd397d81d24d0dc7ed485cba7-cc_ft_1536.jpg,https://photos.zillowstatic.com/fp/54955d2d2317ca96bc1df61133b2a263-cc_ft_1536.jpg,https://photos.zillowstatic.com/fp/ac8a15819070867ecad34507da6c3c92-cc_ft_1536.jpg,https://photos.zillowstatic.com/fp/aac51a802f0d1a2e6abcdf49dbbcb89d-cc_ft_1536.jpg,https://photos.zillowstatic.com/fp/1bdfc6167455eb222fe452237b17b11e-cc_ft_1536.jpg,https://photos.zillowstatic.com/fp/89dc81a3c4fde0668330bbd5e3f3121e-cc_ft_1536.jpg,https://photos.zillowstatic.com/fp/322a5066f3525a08da44c5e181431e6e-cc_ft_1536.jpg,https://photos.zillowstatic.com/fp/498e729de2782032a95e4ba0ca06f4ce-cc_ft_1536.jpg,https://photos.zillowstatic.com/fp/0f2b585d27085105d1dafd8c2a597053-cc_ft_1536.jpg,https://photos.zillowstatic.com/fp/ea62120141845537c9d30500aff4211f-cc_ft_1536.jpg,https://photos.zillowstatic.com/fp/680ffae8a7655e4781a55716a4d762dd-cc_ft_1536.jpg,https://photos.zillowstatic.com/fp/496436d23f5a69058d36dd3baf827081-cc_ft_1536.jpg,https://photos.zillowstatic.com/fp/61cc2d06b0b5a4eb7af6c313180a781b-cc_ft_1536.jpg,https://photos.zillowstatic.com/fp/5a6b6b40cadfe95671ce13b6ffc5de0a-cc_ft_1536.jpg,https://photos.zillowstatic.com/fp/7e00d965a4705114cf2cfc221fc90e96-cc_ft_1536.jpg,https://photos.zillowstatic.com/fp/04d8ee5cd33465816e05128558f9a160-cc_ft_1536.jpg,https://photos.zillowstatic.com/fp/eaa6b093e7918c1341623275ba9a8101-cc_ft_1536.jpg,https://photos.zillowstatic.com/fp/04a4f3f33ccf676b613b426097efabcc-cc_ft_1536.jpg,https://photos.zillowstatic.com/fp/3051242d5b84452728c6c4cd91d63a2f-cc_ft_1536.jpg,https://photos.zillowstatic.com/fp/a21dc44cb17837a885a5aa64947331cd-cc_ft_1536.jpg,https://photos.zillowstatic.com/fp/6a0ae1a98c6be3f01331a1ef77d0a2a7-cc_ft_1536.jpg,https://photos.zillowstatic.com/fp/ca695f39807d44dd4e92c68349770cab-cc_ft_1536.jpg,https://photos.zillowstatic.com/fp/e8b696b3553f4fd4ccb13d0e2da6a180-cc_ft_1536.jpg,https://photos.zillowstatic.com/fp/8bfa7a6d1105a1275c61bdbedc61ea53-cc_ft_1536.jpg,https://photos.zillowstatic.com/fp/592f35c438e766dde3424813337809e1-cc_ft_1536.jpg,https://photos.zillowstatic.com/fp/5a3d309d2fcf8ac7547c96a3e650c0cc-cc_ft_1536.jpg,https://photos.zillowstatic.com/fp/b423198ebe85748474a517d790cbac4d-cc_ft_1536.jpg,https://photos.zillowstatic.com/fp/86c39a55a5d06d3f8ee621e9029fc4a7-cc_ft_1536.jpg,https://photos.zillowstatic.com/fp/cbae67530eef57130f0b714fec1c8734-cc_ft_1536.jpg,https://photos.zillowstatic.com/fp/626afdf92af22996781dc5fec0396d47-cc_ft_1536.jpg,https://photos.zillowstatic.com/fp/dc75953927bc6419336223a1573ceaf7-cc_ft_1536.jpg,https://photos.zillowstatic.com/fp/cfc6a68f2be280abd089aab07f0e0225-cc_ft_1536.jpg,https://photos.zillowstatic.com/fp/4e9a824c82cce4be65254e942dbaa358-cc_ft_1536.jpg,https://photos.zillowstatic.com/fp/1149473261413900aee9990bd142f4d5-cc_ft_1536.jpg,https://photos.zillowstatic.com/fp/24890b614d8f0abad26081ed0efcb33f-cc_ft_1536.jpg,https://photos.zillowstatic.com/fp/3084f0e77243c6ba79977909f186f129-cc_ft_1536.jpg,https://photos.zillowstatic.com/fp/6ab3ef01354727448e14778ac4bc1152-cc_ft_1536.jpg,https://photos.zillowstatic.com/fp/1941c4a79e7cca5e3127ec1c25352747-cc_ft_1536.jpg,https://photos.zillowstatic.com/fp/cfdc30239ca277d87b9df3e54b2e26b8-cc_ft_1536.jpg,https://photos.zillowstatic.com/fp/2eaa132f4dc126f0459122cd832c95fc-cc_ft_1536.jpg,https://photos.zillowstatic.com/fp/1434e0320967e335df064638e01287bf-cc_ft_1536.jpg,https://photos.zillowstatic.com/fp/5a65518b7d196ece882053c232f5d5d2-cc_ft_1536.jpg,https://photos.zillowstatic.com/fp/3df2caa0565613bce5437b8ff99ccd0c-cc_ft_1536.jpg,https://photos.zillowstatic.com/fp/3ea520c201bc8ead4abbc2a3b77edab0-cc_ft_1536.jpg,https://photos.zillowstatic.com/fp/66eb35c8183d808593ce9f11cababc27-cc_ft_1536.jpg,https://photos.zillowstatic.com/fp/17ed673610fd42c75a8109b21130fcb5-cc_ft_1536.jpg,https://photos.zillowstatic.com/fp/79dcf5f331c5380ed13ef5e73af12888-cc_ft_1536.jpg,https://photos.zillowstatic.com/fp/19c52b4e99204a9339d2d34ac7d59c21-cc_ft_1536.jpg,https://photos.zillowstatic.com/fp/501bb5312ef63cf6a6e0df88dc488510-cc_ft_1536.jpg,https://photos.zillowstatic.com/fp/23d731e701936056ea03f64043c17dbc-cc_ft_1536.jpg,https://photos.zillowstatic.com/fp/cbd3b983437fcae1f7755993cfda19a9-cc_ft_1536.jpg,https://photos.zillowstatic.com/fp/4d25bec63b92ecbc49ee846e25eec229-cc_ft_1536.jpg,https://photos.zillowstatic.com/fp/140c3099ffa1f0c4328a8d05feb70e4a-cc_ft_1536.jpg,,,,San Francisco,CA,299 Friedell St,94124,,,,,,,,,,,,,,,,,,,,,,,,,,,,,,,,
2096473586,https://www.zillow.com/homedetails/299-Friedell-299-San-Francisco-CA-94124/2096473586_zpid/,1615,3,3,https://maps.googleapis.com/maps/api/streetview?location=+299+Friedell%2C+San+Francisco%2C+CA+94124&size=1536x1152&key=AIzaSyARFMLB1na-BBWf7_R3-5YOQQaHqEJf6RQ&source=outdoor&&signature=FfW1a2AtFIWv9XElcIDmtm7wwUk=,970000,San Francisco County,SOLD,USD,TOWNHOUSE,37.728138,,-122.369774,,299 Friedell #299,,,"299 Friedell #299, San Francisco, CA 94124 is a townhome home that contains 1,615 sq ft. It contains 3 bedrooms and 3 bathrooms. This home last sold for $970,000 in August 2021. 
 
The Zestimate for this house is $976,100. The Rent Zestimate for this home is $4,940/mo.",706,,,,,,,,https://maps.googleapis.com/maps/api/streetview?location=+299+Friedell%2C+San+Francisco%2C+CA+94124&size=1536x1152&key=AIzaSyARFMLB1na-BBWf7_R3-5YOQQaHqEJf6RQ&source=outdoor&&signature=FfW1a2AtFIWv9XElcIDmtm7wwUk=,,,,,,,,,,,,,,,,,,,,,,,,,,,,,,,,,,,,,,,,,,,,,,,,,,,,,,,,San Francisco,CA,299 Friedell #299,94124,,,,,,,,,,,,,,,,,,,,,,,,,,,,,,,,
15200281,https://www.zillow.com/homedetails/136-Everson-St-San-Francisco-CA-94131/15200281_zpid/,1605,3,2,https://photos.zillowstatic.com/fp/a6884a1ef7162007f30369b8f83c9c93-cc_ft_1536.jpg,1400000,San Francisco County,SOLD,USD,TOWNHOUSE,37.738705,Andrew de Vries,-122.43238,1973,136 Everson St,andrew@probateagent.com,Berkshire Hathaway-Franciscan,"Stunning top-of-the hill Glen Park three-level townhome, with 180-degree direct West-facing Bay and Downtown views on one side AND views of San Francisco to the West on the other, all in an area where townhomes rarely become available. 136 Everson boasts a bright and spacious living room/dining room combination with big windows and a fireplace, an updated galley kitchen, and a primary suite, all on the main level. Upstairs are two ample bedrooms (including one that could be ready for 2nd primary suite conversion) and updated 2nd bathroom. On the ground floor is a bonus hobby/storage room with laundry, a one-car garage with more storage space, and direct access to a low-maintenance patio AND the large open common area behind the home. Fresh paint, carpets and lots of upgrades run throughout. Wonderful Glen Park location close to local shopping and dining, walking paths, parks, dog park, public transit, easy freeway access and more. Come see life on the top of the hill!",707,,415-664-9400,,,,,,https://photos.zillowstatic.com/fp/a6884a1ef7162007f30369b8f83c9c93-cc_ft_1536.jpg,https://photos.zillowstatic.com/fp/7786fd1f9920a1baddc1102598c19da8-cc_ft_1536.jpg,https://photos.zillowstatic.com/fp/1e5fe272e9038b1f6db64e64c5575af0-cc_ft_1536.jpg,https://photos.zillowstatic.com/fp/9bf0fc814b2ffd2074e6f6d37e24cb9a-cc_ft_1536.jpg,https://photos.zillowstatic.com/fp/797c7056b7507fa921c70c7dfc511a5f-cc_ft_1536.jpg,https://photos.zillowstatic.com/fp/4e78b3d099a3a5825495d52f0311dbc8-cc_ft_1536.jpg,https://photos.zillowstatic.com/fp/28fee4521cf4949539741bcb22a64b00-cc_ft_1536.jpg,https://photos.zillowstatic.com/fp/6a71d5f602705a3825e4deb82946a84f-cc_ft_1536.jpg,https://photos.zillowstatic.com/fp/49a5e855121031db3d479df20d7c9b2f-cc_ft_1536.jpg,https://photos.zillowstatic.com/fp/d89c159d728a269063f0e14d9c4b0c1d-cc_ft_1536.jpg,https://photos.zillowstatic.com/fp/f74e7cdaa5426afd5da541675c56e51d-cc_ft_1536.jpg,https://photos.zillowstatic.com/fp/60f81e49605cc5c7db23942e1a83c470-cc_ft_1536.jpg,https://photos.zillowstatic.com/fp/d5f5885b3e64b8e73f7146dc1ad55ad2-cc_ft_1536.jpg,https://photos.zillowstatic.com/fp/a58e295bdd4f41e99ab8c67934cf22fc-cc_ft_1536.jpg,https://photos.zillowstatic.com/fp/d4e09456074858543439f6b73ff1a7e8-cc_ft_1536.jpg,https://photos.zillowstatic.com/fp/f4223472d3effe73605cf487099979b6-cc_ft_1536.jpg,https://photos.zillowstatic.com/fp/30a2fa9867c4df52686a38d4ba6244ee-cc_ft_1536.jpg,https://photos.zillowstatic.com/fp/0450553d53f01c9f78ce17bc87633103-cc_ft_1536.jpg,https://photos.zillowstatic.com/fp/188580d3844d020e3bac5d12929440ea-cc_ft_1536.jpg,https://photos.zillowstatic.com/fp/c4192ae77e2f405f7cb3183e676e91ce-cc_ft_1536.jpg,https://photos.zillowstatic.com/fp/1a01e42ceca3155094bb3238e3eb8b1f-cc_ft_1536.jpg,https://photos.zillowstatic.com/fp/e5b34f37a9d608614c7f27d6037a957c-cc_ft_1536.jpg,https://photos.zillowstatic.com/fp/dfea08c2f9612f81b9167026922972c0-cc_ft_1536.jpg,https://photos.zillowstatic.com/fp/44e3cbbe496898a3c8e25c48478b269e-cc_ft_1536.jpg,https://photos.zillowstatic.com/fp/f5fb7405d3e9ad1f6a9cec7b1010664f-cc_ft_1536.jpg,https://photos.zillowstatic.com/fp/0a8d24976284b8e1453f9876ec714b89-cc_ft_1536.jpg,https://photos.zillowstatic.com/fp/30f2902977ef374d313d7cb326a8cbf5-cc_ft_1536.jpg,https://photos.zillowstatic.com/fp/6d0f03766353de32304b2a46f0ba57eb-cc_ft_1536.jpg,https://photos.zillowstatic.com/fp/4d462c0c49756b9f1f316ad8ac2df9a3-cc_ft_1536.jpg,https://photos.zillowstatic.com/fp/bdf367d52de61a7f4d4d0eb754508906-cc_ft_1536.jpg,https://photos.zillowstatic.com/fp/01452f0236c97cce8fc4e0d5755c257d-cc_ft_1536.jpg,https://photos.zillowstatic.com/fp/cfb947b2ced9e6701690987b67c97f2d-cc_ft_1536.jpg,https://photos.zillowstatic.com/fp/20b801142a5adef52f6b02971615c663-cc_ft_1536.jpg,https://photos.zillowstatic.com/fp/7e82a425fd35927177650df785920b77-cc_ft_1536.jpg,https://photos.zillowstatic.com/fp/43854d9a13ac12995f4b322c31892acc-cc_ft_1536.jpg,https://photos.zillowstatic.com/fp/dbf532f81f12ba08bbf00df93e53ab23-cc_ft_1536.jpg,https://photos.zillowstatic.com/fp/45a69bb2e28cd77f886d5758a19d4e99-cc_ft_1536.jpg,https://photos.zillowstatic.com/fp/08d1919d25b17e8ebb6159d333ebe365-cc_ft_1536.jpg,https://photos.zillowstatic.com/fp/4a473a8d7ddd0fdd97a9548855fa8c01-cc_ft_1536.jpg,https://photos.zillowstatic.com/fp/0de8067d8fbc80fbe0f530152e7d5075-cc_ft_1536.jpg,https://photos.zillowstatic.com/fp/b51f4b5143ecb490a7ebc5727807d9b5-cc_ft_1536.jpg,https://photos.zillowstatic.com/fp/d41600fd8161bf517025f8c6fc3b7765-cc_ft_1536.jpg,https://photos.zillowstatic.com/fp/8392923f617a12b158e2cdc9da5e391a-cc_ft_1536.jpg,https://photos.zillowstatic.com/fp/6f57c9f0cce082a7524ce93ab61a7bcb-cc_ft_1536.jpg,https://photos.zillowstatic.com/fp/ec17d8108d653607214e013d7f0c418d-cc_ft_1536.jpg,https://photos.zillowstatic.com/fp/c84c3b47b412d92fa2572e7865064930-cc_ft_1536.jpg,https://photos.zillowstatic.com/fp/b59569ca8651fd11978e4bee27380d20-cc_ft_1536.jpg,https://photos.zillowstatic.com/fp/8dedb9dceafc6ef5181ba8c6b00aed45-cc_ft_1536.jpg,https://photos.zillowstatic.com/fp/642f7d8e9aa1a49cbc30fbcb9f30643e-cc_ft_1536.jpg,https://photos.zillowstatic.com/fp/e66e73c5305f149a975639138b603609-cc_ft_1536.jpg,https://photos.zillowstatic.com/fp/d1b12e142f2449b1154300f74147a669-cc_ft_1536.jpg,https://photos.zillowstatic.com/fp/244d7c2023a816ad8bbb0e22d14f85c3-cc_ft_1536.jpg,https://photos.zillowstatic.com/fp/b15b3c0fbdc80fae5671f8e69e717dec-cc_ft_1536.jpg,,,,San Francisco,CA,136 Everson St,94131,,,,,,,,,,,,,,,,,,,,,,,,,,,,,,,,
15198377,https://www.zillow.com/homedetails/140-S-Lake-Merced-Hls-San-Francisco-CA-94132/15198377_zpid/,2062,3,3,https://photos.zillowstatic.com/fp/fbb229e92bfd2fc4ff258cacdc5120ba-cc_ft_1536.jpg,1215000,San Francisco County,SOLD,USD,TOWNHOUSE,37.70943,Matthew T. Hilzendrager,-122.48398,1975,140 S Lake Merced Hls,matthilzen@gmail.com,Corcoran Global Living,"Coveted Lake Merced Hills spacious Tri-level townhome ready for your upgrades! Inviting floor plan features a sunken living room, hardwood floors, a wood-burning fireplace, access to outdoor patio deck w/gorgeous views of Lake Merced. Entertain in the formal dining area with built-in buffet-style counters or in the bright eat-in kitchen with lots of cabinet storage, counter space, a laundry closet with washer & dryer, a pantry, breakfast nook, and powder bathroom for convenience. The upper level includes 2 large bedrooms with additional views, a full bath with stall shower + a Master bedroom that includes private en-suite bath & tub, and dual walk-in closets. There's fresh paint, new lighting   & new carpets throughout. The cavernous garage can easily accommodate 2 cars, a workspace, and bonus wine storage room! HOA Community pool, sauna, tennis courts, clubhouse, and 24hr gate security. Fast access to 280 Hwy, Lake Merced, Olympic Golf or Stonestown Galleria, and Trader Joes!",710,415-819-3285,,,,,,,https://photos.zillowstatic.com/fp/fbb229e92bfd2fc4ff258cacdc5120ba-cc_ft_1536.jpg,https://photos.zillowstatic.com/fp/c7ebcf6a273feed24888576e87b3f3fa-cc_ft_1536.jpg,https://photos.zillowstatic.com/fp/16684dffe7e224f7f9cd960ae18aa4ca-cc_ft_1536.jpg,https://photos.zillowstatic.com/fp/ee099a494c87eed01a4f1c90bdfd12f8-cc_ft_1536.jpg,https://photos.zillowstatic.com/fp/57190d19bc23bbb64780ecce16c6ec38-cc_ft_1536.jpg,https://photos.zillowstatic.com/fp/92db95ed1369123f34e0e76eab484bfc-cc_ft_1536.jpg,https://photos.zillowstatic.com/fp/85cb92ca4fa111909a863829dd6a9d98-cc_ft_1536.jpg,https://photos.zillowstatic.com/fp/d8c0cac392ea9f7cb7c3477eb54c10a7-cc_ft_1536.jpg,https://photos.zillowstatic.com/fp/7f62602e37015aa6fbfb5cb696c77a5d-cc_ft_1536.jpg,https://photos.zillowstatic.com/fp/1f98dfb647d0a46b3c3dd7e47a038e14-cc_ft_1536.jpg,https://photos.zillowstatic.com/fp/a33e6f85aab7eefa2614580de890bb8d-cc_ft_1536.jpg,https://photos.zillowstatic.com/fp/957b4b6a01095789f012d0eee3143173-cc_ft_1536.jpg,https://photos.zillowstatic.com/fp/ca9c228eb20bffb8b9cb7508bb982880-cc_ft_1536.jpg,https://photos.zillowstatic.com/fp/1d2c80ab6bcd624999976b0c502d0848-cc_ft_1536.jpg,https://photos.zillowstatic.com/fp/c274c07aefcf305105195d8508015572-cc_ft_1536.jpg,https://photos.zillowstatic.com/fp/708c0d3e491e24cb1a2d91ccc2437923-cc_ft_1536.jpg,https://photos.zillowstatic.com/fp/93a599898fba41d17d38e97ce1c4ecf7-cc_ft_1536.jpg,https://photos.zillowstatic.com/fp/ddb364a922b94516f9bc7d914dccc105-cc_ft_1536.jpg,https://photos.zillowstatic.com/fp/a13394d5640c4d27ed64c043fad50602-cc_ft_1536.jpg,https://photos.zillowstatic.com/fp/c65f0c5b015e3864067ac4b450a38d38-cc_ft_1536.jpg,https://photos.zillowstatic.com/fp/27a92830af984494ab3d30516af12d46-cc_ft_1536.jpg,https://photos.zillowstatic.com/fp/4f38034e1ec04bb13898657373f29aee-cc_ft_1536.jpg,https://photos.zillowstatic.com/fp/ad31677da226fe63e62e8508bf90a5cd-cc_ft_1536.jpg,https://photos.zillowstatic.com/fp/df90a4442b230cdba188bf4ec5046071-cc_ft_1536.jpg,https://photos.zillowstatic.com/fp/c770dc19c85b0c65c29f26de85e91497-cc_ft_1536.jpg,https://photos.zillowstatic.com/fp/c1c55a53dc4d5c653da190348e5ff1dd-cc_ft_1536.jpg,https://photos.zillowstatic.com/fp/79682eaa2ed161aa944a34908cdb483d-cc_ft_1536.jpg,https://photos.zillowstatic.com/fp/b9842fa374a256c893bef785ce42341f-cc_ft_1536.jpg,https://photos.zillowstatic.com/fp/b5fb325383ff072e1c52cf4256318fa6-cc_ft_1536.jpg,https://photos.zillowstatic.com/fp/4ee340e42bacf20bf998bd67afc01fa4-cc_ft_1536.jpg,https://photos.zillowstatic.com/fp/3a774ab8f6ec4f6a6d6fd203cb6cc4b8-cc_ft_1536.jpg,https://photos.zillowstatic.com/fp/3b597d486880f062778da94d28cd997e-cc_ft_1536.jpg,https://photos.zillowstatic.com/fp/2cfbf845e18874db2bbda49dd7f2e506-cc_ft_1536.jpg,https://photos.zillowstatic.com/fp/c3164ab1d9c3417421fd0ae103ffb240-cc_ft_1536.jpg,https://photos.zillowstatic.com/fp/618b4bcaf4d1735efb28855082b2e2b3-cc_ft_1536.jpg,https://photos.zillowstatic.com/fp/b45d5daf40fd302a6be18958b3c258ff-cc_ft_1536.jpg,https://photos.zillowstatic.com/fp/5107b83db024812ea9f6bf8d9047546e-cc_ft_1536.jpg,https://photos.zillowstatic.com/fp/a3c3139cf2c520d3c4c52198a1d6364d-cc_ft_1536.jpg,https://photos.zillowstatic.com/fp/1a7933ddb2da5caae43785b35a5a3bab-cc_ft_1536.jpg,https://photos.zillowstatic.com/fp/4204ef75d53653fdb6e1292249cb7342-cc_ft_1536.jpg,https://photos.zillowstatic.com/fp/49bd070e3563d86e041415cafed8b024-cc_ft_1536.jpg,https://photos.zillowstatic.com/fp/091d4089497eec49d4f82cb25854db00-cc_ft_1536.jpg,https://photos.zillowstatic.com/fp/3009aff0be67eae29d750e8f9b4fc847-cc_ft_1536.jpg,https://photos.zillowstatic.com/fp/3856fa378af07255ef0991178e0b47e1-cc_ft_1536.jpg,https://photos.zillowstatic.com/fp/2b098cd0985172317ba5282d4051c7fd-cc_ft_1536.jpg,https://photos.zillowstatic.com/fp/70e735f4cf7dae761b58804617765c5a-cc_ft_1536.jpg,https://photos.zillowstatic.com/fp/ec1789309fd463526987d80d2805c0ea-cc_ft_1536.jpg,,,,,,,,,,San Francisco,CA,140 S Lake Merced Hls,94132,,,,,,,,,,,,,,,,,,,,,,,,,,,,,,,,
